codigo,unit_idx,frase,actores_payload,actores_version,actores_error,emociones_payload,emociones_version,emociones_error,emociones_pass2_payload,emociones_pass2_version,emociones_pass2_error,created_at,updated_at
casarosada_50299-palabras-del-presidente-de-la-nacion-javier-milei-en-el-54-reunion-anual-del-foro-economico-mundial-de-davos,92,"En lo único que devino esta agenda del feminismo radical es en mayor intervención del estado para entorpecer el proceso económico, darle trabajo a burócratas que no le aportan nada a la sociedad, sea en formato de ministerios de la mujer u organismos internacionales dedicados a promover esta agenda.","[{""marca"": ""feminismo radical"", ""actor"": ""feminismo radical"", ""tipo"": ""colectivo"", ""modo"": ""explicito"", ""justificacion"": ""Mencionado explícitamente como el sujeto impulsor de la agenda.""}, {""marca"": ""estado"", ""actor"": ""Estado"", ""tipo"": ""institucional"", ""modo"": ""explicito"", ""justificacion"": ""Mencionado explícitamente como el agente que interviene.""}, {""marca"": ""burócratas"", ""actor"": ""burócratas"", ""tipo"": ""colectivo"", ""modo"": ""explicito"", ""justificacion"": ""Mencionados explícitamente como beneficiarios de trabajo.""}, {""marca"": ""la sociedad"", ""actor"": ""la sociedad"", ""tipo"": ""colectivo"", ""modo"": ""explicito"", ""justificacion"": ""Mencionada explícitamente como la entidad que no recibe aporte.""}, {""marca"": ""ministerios de la mujer"", ""actor"": ""ministerios de la mujer"", ""tipo"": ""institucional"", ""modo"": ""explicito"", ""justificacion"": ""Mencionados explícitamente como estructuras institucionales.""}, {""marca"": ""organismos internacionales"", ""actor"": ""organismos internacionales"", ""tipo"": ""institucional"", ""modo"": ""explicito"", ""justificacion"": ""Mencionados explícitamente como entidades dedicadas a promover la agenda.""}]",v22,,"[{""experienciador"": ""Javier Milei"", ""experienciador_marca"": ""devino"", ""tipo_emocion"": ""indignación"", ""fuente_marca"": ""feminismo radical"", ""fuente_inferencia"": ""feminismo radical"", ""modo_existencia"": ""actual"", ""tipo_configuracion"": ""cualificacion_por_indicadores_axiologicos""}, {""experienciador"": ""Javier Milei"", ""experienciador_marca"": ""devino"", ""tipo_emocion"": ""desprecio"", ""fuente_marca"": ""burócratas que no le aportan nada"", ""fuente_inferencia"": ""burócratas"", ""modo_existencia"": ""actual"", ""tipo_configuracion"": ""cualificacion_por_indicadores_axiologicos""}]",v22,,,,,2026-06-24 08:56:08,2026-07-02 21:26:26.372216+00:00
casarosada_50299-palabras-del-presidente-de-la-nacion-javier-milei-en-el-54-reunion-anual-del-foro-economico-mundial-de-davos,93,Otro de los conflictos que los socialistas plantean es el del hombre contra la naturaleza.,"[{""marca"": ""los socialistas"", ""actor"": ""socialistas"", ""tipo"": ""colectivo"", ""modo"": ""explicito"", ""justificacion"": ""Mencionados explícitamente como quienes plantean el conflicto.""}, {""marca"": ""el hombre"", ""actor"": ""el hombre"", ""tipo"": ""colectivo"", ""modo"": ""explicito"", ""justificacion"": ""Mencionado explícitamente como una de las partes en conflicto.""}, {""marca"": ""la naturaleza"", ""actor"": ""la naturaleza"", ""tipo"": ""institucional"", ""modo"": ""explicito"", ""justificacion"": ""Mencionada explícitamente como la entidad contra la cual se plantea el conflicto.""}]",v22,,[],v22,,,,,2026-06-24 08:56:08,2026-07-02 21:26:26.372335+00:00
casarosada_50299-palabras-del-presidente-de-la-nacion-javier-milei-en-el-54-reunion-anual-del-foro-economico-mundial-de-davos,94,"Sostienen que los seres humanos dañamos el planeta y que debe ser protegido a toda costa, incluso llegando a abogar por mecanismos de control poblacional o en la agenda sangrienta del aborto.","[{""marca"": ""Sostienen"", ""actor"": ""Sujetos que sostienen que los seres humanos dañan el planeta (posiblemente globalistas o élites ambientales)"", ""tipo"": ""colectivo"", ""modo"": ""inferido"", ""justificacion"": ""Sujeto tácito elíptico en la conjugación verbal 'Sostienen'.""}, {""marca"": ""los seres humanos"", ""actor"": ""los seres humanos"", ""tipo"": ""colectivo"", ""modo"": ""explicito"", ""justificacion"": ""Mencionado explícitamente como sujeto de la acción de dañar el planeta.""}]",v22,,"[{""experienciador"": ""Javier Milei"", ""experienciador_marca"": ""Sostienen"", ""tipo_emocion"": ""indignación"", ""fuente_marca"": ""agenda sangrienta del aborto"", ""fuente_inferencia"": ""la agenda del aborto"", ""modo_existencia"": ""actual"", ""tipo_configuracion"": ""cualificacion_por_indicadores_axiologicos""}]",v22,,,,,2026-06-24 08:56:08,2026-07-02 21:26:26.372439+00:00
casarosada_50299-palabras-del-presidente-de-la-nacion-javier-milei-en-el-54-reunion-anual-del-foro-economico-mundial-de-davos,95,"Lamentablemente, estas ideas nocivas han impregnado fuertemente en nuestra sociedad.","[{""marca"": ""nuestra sociedad"", ""actor"": ""sociedad"", ""tipo"": ""colectivo"", ""modo"": ""explicito"", ""justificacion"": ""Mencionada explícitamente como el grupo donde han impregnado las ideas.""}]",v22,,"[{""experienciador"": ""Javier Milei"", ""experienciador_marca"": ""Lamentablemente"", ""tipo_emocion"": ""pesar"", ""fuente_marca"": ""estas ideas nocivas"", ""fuente_inferencia"": ""ideas nocivas en la sociedad"", ""modo_existencia"": ""realizada"", ""tipo_configuracion"": ""ordenado_alrededor_de_verbos_psicologicos""}]",v22,,,,,2026-06-24 08:56:08,2026-07-02 21:26:26.372537+00:00
casarosada_50299-palabras-del-presidente-de-la-nacion-javier-milei-en-el-54-reunion-anual-del-foro-economico-mundial-de-davos,96,Los neo-marxistas han sabido cooptar el sentido común de occidente.,"[{""marca"": ""Los neo-marxistas"", ""actor"": ""los neo-marxistas"", ""tipo"": ""colectivo"", ""modo"": ""explicito"", ""justificacion"": ""Mencionado explícitamente como el sujeto que realiza la acción de cooptar.""}, {""marca"": ""occidente"", ""actor"": ""la sociedad occidental"", ""tipo"": ""colectivo"", ""modo"": ""inferido"", ""justificacion"": ""Inferido como el paciente/afectado a través de la mención a su 'sentido común'.""}]",v22,,"[{""experienciador"": ""Javier Milei"", ""experienciador_marca"": ""no identificado"", ""tipo_emocion"": ""indignación"", ""fuente_marca"": ""Los neo-marxistas"", ""fuente_inferencia"": ""los neo-marxistas"", ""modo_existencia"": ""actual"", ""tipo_configuracion"": ""cualificacion_por_indicadores_axiologicos""}]",v22,,,,,2026-06-24 08:56:08,2026-07-02 21:26:26.372634+00:00
casarosada_50299-palabras-del-presidente-de-la-nacion-javier-milei-en-el-54-reunion-anual-del-foro-economico-mundial-de-davos,97,"Lograron esto gracias a la apropiación de los medios de comunicación, de la cultura, de las universidades, y sí, también de los organismos internacionales.","[{""marca"": ""Lograron"", ""actor"": ""actores políticos/ideológicos opositores"", ""tipo"": ""colectivo"", ""modo"": ""inferido"", ""justificacion"": ""El verbo 'Lograron' posee un sujeto tácito que se refiere a quienes realizaron la apropiación.""}, {""marca"": ""medios de comunicación"", ""actor"": ""medios de comunicación"", ""tipo"": ""institucional"", ""modo"": ""explicito"", ""justificacion"": ""Mencionados explícitamente como entidades apropiadas.""}, {""marca"": ""universidades"", ""actor"": ""universidades"", ""tipo"": ""institucional"", ""modo"": ""explicito"", ""justificacion"": ""Mencionadas explícitamente como entidades apropiadas.""}, {""marca"": ""organismos internacionales"", ""actor"": ""organismos internacionales"", ""tipo"": ""institucional"", ""modo"": ""explicito"", ""justificacion"": ""Mencionados explícitamente como entidades apropiadas.""}]",v22,,"[{""experienciador"": ""Javier Milei"", ""experienciador_marca"": ""Lograron"", ""tipo_emocion"": ""indignación"", ""fuente_marca"": ""apropiación de los medios"", ""fuente_inferencia"": ""la apropiación de instituciones"", ""modo_existencia"": ""actual"", ""tipo_configuracion"": ""cualificacion_por_indicadores_axiologicos""}]",v22,,,,,2026-06-24 08:56:08,2026-07-02 21:26:26.372731+00:00
casarosada_50299-palabras-del-presidente-de-la-nacion-javier-milei-en-el-54-reunion-anual-del-foro-economico-mundial-de-davos,98,"Por suerte, somos cada vez más los que nos atrevemos a levantar la voz.","[{""marca"": ""somos cada vez más los que nos atrevemos"", ""actor"": ""Javier Milei y personas afines a su postura"", ""tipo"": ""colectivo"", ""modo"": ""inferido"", ""justificacion"": ""El pronombre 'somos' y 'nos' incluye al enunciador y a otros sujetos que comparten su acción.""}]",v22,,"[{""experienciador"": ""Javier Milei y personas afines a su postura"", ""experienciador_marca"": ""somos"", ""tipo_emocion"": ""valentía"", ""fuente_marca"": ""levantar la voz"", ""fuente_inferencia"": ""el acto de denunciar o expresarse"", ""modo_existencia"": ""realizada"", ""tipo_configuracion"": ""cualificacion_por_indicadores_comportamiento""}, {""experienciador"": ""Javier Milei y personas afines a su postura"", ""experienciador_marca"": ""somos"", ""tipo_emocion"": ""alivio"", ""fuente_marca"": ""cada vez más los que nos atrevemos"", ""fuente_inferencia"": ""el incremento de personas que se atreven"", ""modo_existencia"": ""realizada"", ""tipo_configuracion"": ""cualificacion_por_indicadores_axiologicos""}]",v22,,,,,2026-06-24 08:56:08,2026-07-02 21:26:26.372833+00:00
casarosada_50299-palabras-del-presidente-de-la-nacion-javier-milei-en-el-54-reunion-anual-del-foro-economico-mundial-de-davos,99,"Porque vemos que, si no combatimos frontalmente estas ideas, el único destino posible es que cada vez vamos a tener más estado, más regulación, más socialismo, más pobreza, menos libertad, y, en consecuencia, peor nivel de vida.","[{""marca"": ""vemos"", ""actor"": ""Javier Milei y sus seguidores/aliados"", ""tipo"": ""colectivo"", ""modo"": ""inferido"", ""justificacion"": ""El pronombre 'vemos' y 'vamos a tener' implica un sujeto colectivo que incluye al enunciador.""}, {""marca"": ""estas ideas"", ""actor"": ""Promotores de ideas colectivistas/socialistas"", ""tipo"": ""colectivo"", ""modo"": ""inferido"", ""justificacion"": ""La acción de 'combatir frontalmente estas ideas' implica la existencia de actores que sostienen y difunden dichas ideas.""}, {""marca"": ""estado"", ""actor"": ""El Estado"", ""tipo"": ""institucional"", ""modo"": ""explicito"", ""justificacion"": ""Se menciona explícitamente como la entidad que se expande ('más estado').""}]",v22,,"[{""experienciador"": ""Javier Milei y sus seguidores/aliados"", ""experienciador_marca"": ""vemos"", ""tipo_emocion"": ""temor"", ""fuente_marca"": ""más estado, más regulación, más socialismo"", ""fuente_inferencia"": ""el avance del estado y el socialismo"", ""modo_existencia"": ""actual"", ""tipo_configuracion"": ""cualificacion_por_indicadores_cognitivos""}, {""experienciador"": ""Javier Milei y sus seguidores/aliados"", ""experienciador_marca"": ""vemos"", ""tipo_emocion"": ""indignación"", ""fuente_marca"": ""más pobreza, menos libertad"", ""fuente_inferencia"": ""la pérdida de libertad y aumento de pobreza"", ""modo_existencia"": ""actual"", ""tipo_configuracion"": ""cualificacion_por_indicadores_axiologicos""}]",v22,,,,,2026-06-24 08:56:08,2026-07-02 21:26:26.372937+00:00
casarosada_50299-palabras-del-presidente-de-la-nacion-javier-milei-en-el-54-reunion-anual-del-foro-economico-mundial-de-davos,100,"Occidente, lamentablemente, ya comenzó a transitar este camino.","[{""marca"": ""Occidente"", ""actor"": ""Occidente"", ""tipo"": ""colectivo"", ""modo"": ""explicito"", ""justificacion"": ""Se menciona explícitamente como el sujeto que transita un camino.""}]",v22,,"[{""experienciador"": ""Javier Milei"", ""experienciador_marca"": ""lamentablemente"", ""tipo_emocion"": ""pesar"", ""fuente_marca"": ""transitar este camino"", ""fuente_inferencia"": ""el camino transitado por Occidente"", ""modo_existencia"": ""realizada"", ""tipo_configuracion"": ""ordenado_alrededor_de_verbos_psicologicos""}]",v22,,,,,2026-06-24 08:56:08,2026-07-02 21:26:26.373035+00:00
casarosada_50299-palabras-del-presidente-de-la-nacion-javier-milei-en-el-54-reunion-anual-del-foro-economico-mundial-de-davos,101,Sé que a muchos les puede sonar ridículo plantear que occidente se ha volcado al socialismo.,"[{""marca"": ""muchos"", ""actor"": ""muchos"", ""tipo"": ""colectivo"", ""modo"": ""explicito"", ""justificacion"": ""Mencionado explícitamente como los receptores de la idea planteada.""}, {""marca"": ""occidente"", ""actor"": ""Occidente"", ""tipo"": ""colectivo"", ""modo"": ""explicito"", ""justificacion"": ""Mencionado explícitamente como la entidad que se ha volcado al socialismo.""}]",v22,,"[{""experienciador"": ""los asistentes al Foro de Davos"", ""experienciador_marca"": ""muchos"", ""tipo_emocion"": ""desdén"", ""fuente_marca"": ""plantear que occidente se ha volcado al socialismo"", ""fuente_inferencia"": ""la tesis de Milei sobre Occidente"", ""modo_existencia"": ""potencial"", ""tipo_configuracion"": ""cualificacion_por_indicadores_cognitivos""}]",v22,,,,,2026-06-24 08:56:08,2026-07-02 21:26:26.373132+00:00
casarosada_50299-palabras-del-presidente-de-la-nacion-javier-milei-en-el-54-reunion-anual-del-foro-economico-mundial-de-davos,102,"Pero sólo es ridículo en la medida que uno se restringe a la definición económica tradicional del socialismo, que establece que es un sistema económico donde el estado es el dueño de los medios de producción.","[{""marca"": ""uno"", ""actor"": ""persona genérica / individuo"", ""tipo"": ""humano_individual"", ""modo"": ""explicito"", ""justificacion"": ""El pronombre 'uno' funciona como un sujeto indeterminado que realiza la acción de restringirse.""}, {""marca"": ""el estado"", ""actor"": ""Estado"", ""tipo"": ""institucional"", ""modo"": ""explicito"", ""justificacion"": ""Se menciona explícitamente como el dueño de los medios de producción.""}]",v22,,"[{""experienciador"": ""persona genérica / individuo"", ""experienciador_marca"": ""uno"", ""tipo_emocion"": ""desdén"", ""fuente_marca"": ""definición económica tradicional del socialismo"", ""fuente_inferencia"": ""definición económica tradicional del socialismo"", ""modo_existencia"": ""actual"", ""tipo_configuracion"": ""cualificacion_por_indicadores_cognitivos""}]",v22,,,,,2026-06-24 08:56:08,2026-07-02 21:26:26.373249+00:00
casarosada_50299-palabras-del-presidente-de-la-nacion-javier-milei-en-el-54-reunion-anual-del-foro-economico-mundial-de-davos,103,"Esta definición debiera ser, para nosotros, actualizada a las circunstancias presentes.","[{""marca"": ""nosotros"", ""actor"": ""Javier Milei y su equipo/gobierno"", ""tipo"": ""colectivo"", ""modo"": ""inferido"", ""justificacion"": ""El pronombre 'nosotros' incluye al enunciador y a quienes representan""}]",v22,,"[{""experienciador"": ""Javier Milei y su equipo/gobierno"", ""experienciador_marca"": ""nosotros"", ""tipo_emocion"": ""insatisfacción"", ""fuente_marca"": ""Esta definición"", ""fuente_inferencia"": ""definición desactualizada"", ""modo_existencia"": ""actual"", ""tipo_configuracion"": ""cualificacion_por_indicadores_cognitivos""}]",v22,,,,,2026-06-24 08:56:08,2026-07-02 21:26:26.373373+00:00
casarosada_50299-palabras-del-presidente-de-la-nacion-javier-milei-en-el-54-reunion-anual-del-foro-economico-mundial-de-davos,104,Hoy los estados no necesitan controlar directamente los medios de producción para controlar cada aspecto de la vida de los individuos.,"[{""marca"": ""los estados"", ""actor"": ""los estados"", ""tipo"": ""institucional"", ""modo"": ""explicito"", ""justificacion"": ""La expresión 'los estados' aparece explícitamente como el sujeto que realiza la acción de controlar.""}, {""marca"": ""los individuos"", ""actor"": ""los individuos"", ""tipo"": ""colectivo"", ""modo"": ""explicito"", ""justificacion"": ""La expresión 'los individuos' aparece explícitamente como los sujetos afectados por el control.""}]",v22,,"[{""experienciador"": ""Javier Milei"", ""experienciador_marca"": ""no identificado"", ""tipo_emocion"": ""indignación"", ""fuente_marca"": ""controlar cada aspecto de la vida"", ""fuente_inferencia"": ""el control estatal sobre la vida"", ""modo_existencia"": ""actual"", ""tipo_configuracion"": ""cualificacion_por_indicadores_axiologicos""}]",v22,,,,,2026-06-24 08:56:08,2026-07-02 21:26:26.373478+00:00
casarosada_50299-palabras-del-presidente-de-la-nacion-javier-milei-en-el-54-reunion-anual-del-foro-economico-mundial-de-davos,105,"Con herramientas como la emisión monetaria, el endeudamiento, los subsidios, el control de la tasa de interés, los controles de precios y las regulaciones para corregir los supuestos “fallos de mercado”, pueden controlar los destinos de millones de seres humanos.","[{""marca"": ""pueden controlar"", ""actor"": ""Estado/Gobierno"", ""tipo"": ""institucional"", ""modo"": ""inferido"", ""justificacion"": ""La capacidad de ejecutar emisión monetaria, subsidios y regulaciones es una facultad exclusiva de entidades gubernamentales o estatales.""}, {""marca"": ""millones de seres humanos"", ""actor"": ""millones de seres humanos"", ""tipo"": ""colectivo"", ""modo"": ""explicito"", ""justificacion"": ""El texto menciona explícitamente a las personas que son objeto del control.""}]",v22,,"[{""experienciador"": ""millones de seres humanos"", ""experienciador_marca"": ""millones de seres humanos"", ""tipo_emocion"": ""indefensión"", ""fuente_marca"": ""no identificado"", ""fuente_inferencia"": ""el Estado/Gobierno"", ""modo_existencia"": ""virtual"", ""tipo_configuracion"": ""transposicion_situacion_reconocimiento_potencial""}]",v22,,,,,2026-06-24 08:56:08,2026-07-02 21:26:26.373576+00:00
casarosada_50299-palabras-del-presidente-de-la-nacion-javier-milei-en-el-54-reunion-anual-del-foro-economico-mundial-de-davos,106,"Así es como llegamos al punto en el que con distintos nombres o formas, buena parte de las ofertas políticas generalmente aceptadas en la mayoría de los países de occidente son variantes colectivistas.","[{""marca"": ""llegamos"", ""actor"": ""Javier Milei"", ""tipo"": ""humano_individual"", ""modo"": ""inferido"", ""justificacion"": ""Sujeto tácito del verbo 'llegamos' (primera persona del plural con valor de enunciador).""}, {""marca"": ""ofertas políticas"", ""actor"": ""actores políticos / partidos políticos"", ""tipo"": ""colectivo"", ""modo"": ""inferido"", ""justificacion"": ""Sujeto implícito que genera las 'ofertas políticas'.""}]",v22,,"[{""experienciador"": ""Javier Milei"", ""experienciador_marca"": ""llegamos"", ""tipo_emocion"": ""indignación"", ""fuente_marca"": ""variantes colectivistas"", ""fuente_inferencia"": ""ofertas políticas colectivistas"", ""modo_existencia"": ""actual"", ""tipo_configuracion"": ""cualificacion_por_indicadores_axiologicos""}]",v22,,,,,2026-06-24 08:56:08,2026-07-02 21:26:26.373686+00:00
casarosada_50299-palabras-del-presidente-de-la-nacion-javier-milei-en-el-54-reunion-anual-del-foro-economico-mundial-de-davos,107,"Ya sea que se declaren abiertamente comunistas, o socialistas, socialdemócratas, demócratas cristianos, neokeynesianos, progresistas, populistas, nacionalistas o globalistas.","[{""marca"": ""comunistas"", ""actor"": ""comunistas"", ""tipo"": ""colectivo"", ""modo"": ""explicito"", ""justificacion"": ""Mención explícita de un colectivo político.""}, {""marca"": ""socialistas"", ""actor"": ""socialistas"", ""tipo"": ""colectivo"", ""modo"": ""explicito"", ""justificacion"": ""Mención explícita de un colectivo político.""}, {""marca"": ""socialdemócratas"", ""actor"": ""socialdemócratas"", ""tipo"": ""colectivo"", ""modo"": ""explicito"", ""justificacion"": ""Mención explícita de un colectivo político.""}, {""marca"": ""demócratas cristianos"", ""actor"": ""demócratas cristianos"", ""tipo"": ""colectivo"", ""modo"": ""explicito"", ""justificacion"": ""Mención explícita de un colectivo político.""}, {""marca"": ""neokeynesianos"", ""actor"": ""neokeynesianos"", ""tipo"": ""colectivo"", ""modo"": ""explicito"", ""justificacion"": ""Mención explícita de un colectivo político/económico.""}, {""marca"": ""progresistas"", ""actor"": ""progresistas"", ""tipo"": ""colectivo"", ""modo"": ""explicito"", ""justificacion"": ""Mención explícita de un colectivo político.""}, {""marca"": ""populistas"", ""actor"": ""populistas"", ""tipo"": ""colectivo"", ""modo"": ""explicito"", ""justificacion"": ""Mención explícita de un colectivo político.""}, {""marca"": ""nacionalistas"", ""actor"": ""nacionalistas"", ""tipo"": ""colectivo"", ""modo"": ""explicito"", ""justificacion"": ""Mención explícita de un colectivo político.""}, {""marca"": ""globalistas"", ""actor"": ""globalistas"", ""tipo"": ""colectivo"", ""modo"": ""explicito"", ""justificacion"": ""Mención explícita de un colectivo político/ideológico.""}]",v22,,"[{""experienciador"": ""Javier Milei"", ""experienciador_marca"": ""no identificado"", ""tipo_emocion"": ""rechazo"", ""fuente_marca"": ""comunistas"", ""fuente_inferencia"": ""los comunistas"", ""modo_existencia"": ""actual"", ""tipo_configuracion"": ""cualificacion_por_indicadores_axiologicos""}, {""experienciador"": ""Javier Milei"", ""experienciador_marca"": ""no identificado"", ""tipo_emocion"": ""rechazo"", ""fuente_marca"": ""socialistas"", ""fuente_inferencia"": ""los socialistas"", ""modo_existencia"": ""actual"", ""tipo_configuracion"": ""cualificacion_por_indicadores_axiologicos""}, {""experienciador"": ""Javier Milei"", ""experienciador_marca"": ""no identificado"", ""tipo_emocion"": ""rechazo"", ""fuente_marca"": ""socialdemócratas"", ""fuente_inferencia"": ""los socialdemócratas"", ""modo_existencia"": ""actual"", ""tipo_configuracion"": ""cualificacion_por_indicadores_axiologicos""}, {""experienciador"": ""Javier Milei"", ""experienciador_marca"": ""no identificado"", ""tipo_emocion"": ""rechazo"", ""fuente_marca"": ""demócratas cristianos"", ""fuente_inferencia"": ""los demócratas cristianos"", ""modo_existencia"": ""actual"", ""tipo_configuracion"": ""cualificacion_por_indicadores_axiologicos""}, {""experienciador"": ""Javier Milei"", ""experienciador_marca"": ""no identificado"", ""tipo_emocion"": ""rechazo"", ""fuente_marca"": ""neokeynesianos"", ""fuente_inferencia"": ""los neokeynesianos"", ""modo_existencia"": ""actual"", ""tipo_configuracion"": ""cualificacion_por_indicadores_axiologicos""}, {""experienciador"": ""Javier Milei"", ""experienciador_marca"": ""no identificado"", ""tipo_emocion"": ""rechazo"", ""fuente_marca"": ""progresistas"", ""fuente_inferencia"": ""los progresistas"", ""modo_existencia"": ""actual"", ""tipo_configuracion"": ""cualificacion_por_indicadores_axiologicos""}, {""experienciador"": ""Javier Milei"", ""experienciador_marca"": ""no identificado"", ""tipo_emocion"": ""rechazo"", ""fuente_marca"": ""populistas"", ""fuente_inferencia"": ""los populistas"", ""modo_existencia"": ""actual"", ""tipo_configuracion"": ""cualificacion_por_indicadores_axiologicos""}, {""experienciador"": ""Javier Milei"", ""experienciador_marca"": ""no identificado"", ""tipo_emocion"": ""rechazo"", ""fuente_marca"": ""nacionalistas"", ""fuente_inferencia"": ""los nacionalistas"", ""modo_existencia"": ""actual"", ""tipo_configuracion"": ""cualificacion_por_indicadores_axiologicos""}, {""experienciador"": ""Javier Milei"", ""experienciador_marca"": ""no identificado"", ""tipo_emocion"": ""rechazo"", ""fuente_marca"": ""globalistas"", ""fuente_inferencia"": ""los globalistas"", ""modo_existencia"": ""actual"", ""tipo_configuracion"": ""cualificacion_por_indicadores_axiologicos""}]",v22,,,,,2026-06-24 08:56:08,2026-07-02 21:26:26.373825+00:00
casarosada_50299-palabras-del-presidente-de-la-nacion-javier-milei-en-el-54-reunion-anual-del-foro-economico-mundial-de-davos,108,En el fondo no hay diferencias sustantivas: todas sostienen que el estado debe dirigir todos los aspectos de la vida de los individuos.,"[{""marca"": ""el estado"", ""actor"": ""el estado"", ""tipo"": ""institucional"", ""modo"": ""explicito"", ""justificacion"": ""El texto menciona explícitamente al estado como el sujeto que debe dirigir.""}, {""marca"": ""los individuos"", ""actor"": ""los individuos"", ""tipo"": ""colectivo"", ""modo"": ""explicito"", ""justificacion"": ""El texto menciona explícitamente a los individuos como los sujetos sobre quienes se ejerce la acción.""}, {""marca"": ""todas"", ""actor"": ""doctrinas o posturas políticas"", ""tipo"": ""colectivo"", ""modo"": ""inferido"", ""justificacion"": ""El pronombre 'todas' refiere a Entities/doctrinas implícitas que 'sostienen' una postura.""}]",v22,,"[{""experienciador"": ""Javier Milei"", ""experienciador_marca"": ""no identificado"", ""tipo_emocion"": ""indignación"", ""fuente_marca"": ""el estado debe dirigir todos los aspectos"", ""fuente_inferencia"": ""la intervención del estado"", ""modo_existencia"": ""actual"", ""tipo_configuracion"": ""cualificacion_por_indicadores_axiologicos""}]",v22,,,,,2026-06-24 08:56:08,2026-07-02 21:26:26.373938+00:00
