codigo,unit_idx,frase,actores_payload,actores_version,actores_error,emociones_payload,emociones_version,emociones_error,emociones_pass2_payload,emociones_pass2_version,emociones_pass2_error,created_at,updated_at
casarosada_50371-palabras-del-presidente-de-la-nacion-javier-milei-en-la-conferencia-politica-de-accion-conservadora-cpac-en-washington-estados-unidos,51,"Es decir, que aumentó la productividad per cápita y, además, el PBI aumentó cerca de 150 veces, a punto tal que estamos en el mejor momento de la historia de la humanidad.","[{""marca"": ""la humanidad"", ""actor"": ""humanidad"", ""tipo"": ""colectivo"", ""modo"": ""explicito"", ""justificacion"": ""La expresión 'la historia de la humanidad' hace referencia al colectivo humano en su totalidad.""}, {""marca"": ""estamos"", ""actor"": ""seres humanos / sociedad actual"", ""tipo"": ""colectivo"", ""modo"": ""inferido"", ""justificacion"": ""El pronombre 'estamos' indica un sujeto tácito que se incluye a sí mismo y a otros en el tiempo presente.""}]",v22,,"[{""experienciador"": ""la sociedad actual"", ""experienciador_marca"": ""estamos"", ""tipo_emocion"": ""satisfacción"", ""fuente_marca"": ""el mejor momento de la historia"", ""fuente_inferencia"": ""la situación histórica actual"", ""modo_existencia"": ""realizada"", ""tipo_configuracion"": ""cualificacion_por_indicadores_axiologicos""}]",v22,,,,,2026-06-24 08:56:08,2026-07-02 22:02:50.349946+00:00
casarosada_50371-palabras-del-presidente-de-la-nacion-javier-milei-en-la-conferencia-politica-de-accion-conservadora-cpac-en-washington-estados-unidos,52,"Todo esto, a pesar de la existencia del Estado.","[{""marca"": ""el Estado"", ""actor"": ""el Estado"", ""tipo"": ""institucional"", ""modo"": ""explicito"", ""justificacion"": ""La expresión 'el Estado' menciona explícitamente a la entidad institucional.""}]",v22,,[],v22,,,,,2026-06-24 08:56:08,2026-07-02 22:02:50.350031+00:00
casarosada_50371-palabras-del-presidente-de-la-nacion-javier-milei-en-la-conferencia-politica-de-accion-conservadora-cpac-en-washington-estados-unidos,53,"Y en este mismo periodo de tan importante crecimiento económico, la pobreza extrema pasó del 95% de la población al 5%.","[{""marca"": ""población"", ""actor"": ""población"", ""tipo"": ""colectivo"", ""modo"": ""explicito"", ""justificacion"": ""Se menciona explícitamente como el grupo afectado por la pobreza extrema.""}]",v22,,"[{""experienciador"": ""la población"", ""experienciador_marca"": ""población"", ""tipo_emocion"": ""sufrimiento"", ""fuente_marca"": ""pobreza extrema"", ""fuente_inferencia"": ""pobreza extrema"", ""modo_existencia"": ""realizada"", ""tipo_configuracion"": ""cualificacion_por_componentes_descriptivo_narrativos""}]",v22,,,,,2026-06-24 08:56:08,2026-07-02 22:02:50.350120+00:00
casarosada_50371-palabras-del-presidente-de-la-nacion-javier-milei-en-la-conferencia-politica-de-accion-conservadora-cpac-en-washington-estados-unidos,54,"Sin embargo, esta presencia de rendimientos crecientes significa que hay estructuras concentradas, es decir, que hay monopolios.","[{""marca"": ""monopolios"", ""actor"": ""monopolios"", ""tipo"": ""institucional"", ""modo"": ""explicito"", ""justificacion"": ""Se mencionan explícitamente como estructuras concentradas.""}]",v22,,[],v22,,,,,2026-06-24 08:56:08,2026-07-02 22:02:50.350205+00:00
casarosada_50371-palabras-del-presidente-de-la-nacion-javier-milei-en-la-conferencia-politica-de-accion-conservadora-cpac-en-washington-estados-unidos,55,"Entonces, la pregunta es: si se generó tanto bienestar ¿Por qué la teoría neoclásica dice que los monopolios son malos, si nos trajo tanto bienestar y tanta caída en la pobreza?","[{""marca"": ""la teoría neoclásica"", ""actor"": ""teoría neoclásica"", ""tipo"": ""institucional"", ""modo"": ""explicito"", ""justificacion"": ""Se menciona explícitamente como la entidad que emite un juicio sobre los monopolios.""}, {""marca"": ""los monopolios"", ""actor"": ""monopolios"", ""tipo"": ""institucional"", ""modo"": ""explicito"", ""justificacion"": ""Se mencionan como las entidades que son calificadas de 'malos' y que generan bienestar.""}, {""marca"": ""nos"", ""actor"": ""población / sociedad"", ""tipo"": ""colectivo"", ""modo"": ""inferido"", ""justificacion"": ""El pronombre 'nos' en 'nos trajo' implica un colectivo receptor del bienestar y la reducción de pobreza.""}]",v22,,"[{""experienciador"": ""Javier Milei"", ""experienciador_marca"": ""la pregunta es"", ""tipo_emocion"": ""escepticismo"", ""fuente_marca"": ""la teoría neoclásica"", ""fuente_inferencia"": ""teoría neoclásica"", ""modo_existencia"": ""actual"", ""tipo_configuracion"": ""cualificacion_por_indicadores_cognitivos""}]",v22,,,,,2026-06-24 08:56:08,2026-07-02 22:02:50.350294+00:00
casarosada_50371-palabras-del-presidente-de-la-nacion-javier-milei-en-la-conferencia-politica-de-accion-conservadora-cpac-en-washington-estados-unidos,56,"Y en realidad, como diría Murray Newton Rothbard, el inventor del anarco capitalismo, el problema es que el análisis neoclásico está mal.","[{""marca"": ""Murray Newton Rothbard"", ""actor"": ""Murray Newton Rothbard"", ""tipo"": ""humano_individual"", ""modo"": ""explicito"", ""justificacion"": ""El texto menciona explícitamente su nombre.""}]",v22,,[],v22,,,,,2026-06-24 08:56:08,2026-07-02 22:02:50.350381+00:00
casarosada_50371-palabras-del-presidente-de-la-nacion-javier-milei-en-la-conferencia-politica-de-accion-conservadora-cpac-en-washington-estados-unidos,57,"Supongamos que tengo 10 empresas compitiendo por hacer teléfonos celulares, y una de ellas descubre una técnica para hacer un teléfono de mejor calidad a un mejor precio, naturalmente hay 9 empresas que van a quebrar.","[{""marca"": ""10 empresas"", ""actor"": ""empresas"", ""tipo"": ""institucional"", ""modo"": ""explicito"", ""justificacion"": ""Se menciona explícitamente la existencia de 10 empresas en competencia.""}, {""marca"": ""una de ellas"", ""actor"": ""una empresa"", ""tipo"": ""institucional"", ""modo"": ""explicito"", ""justificacion"": ""Se identifica a una entidad específica dentro del grupo que descubre una técnica.""}, {""marca"": ""9 empresas"", ""actor"": ""empresas que quiebran"", ""tipo"": ""institucional"", ""modo"": ""explicito"", ""justificacion"": ""Se menciona el grupo de empresas que resultan derrotadas por la competencia.""}]",v22,,[],v22,,,,,2026-06-24 08:56:08,2026-07-02 22:02:50.350473+00:00
casarosada_50371-palabras-del-presidente-de-la-nacion-javier-milei-en-la-conferencia-politica-de-accion-conservadora-cpac-en-washington-estados-unidos,58,"Sin embargo, ¿Alguno de ustedes se quejaría por tener mejores teléfonos a un mejor precio?","[{""marca"": ""ustedes"", ""actor"": ""oyentes/asistentes de la conferencia CPAC"", ""tipo"": ""colectivo"", ""modo"": ""inferido"", ""justificacion"": ""El pronombre 'ustedes' se refiere directamente a los interlocutores presentes en el evento.""}]",v22,,"[{""experienciador"": ""asistentes de la conferencia CPAC"", ""experienciador_marca"": ""ustedes"", ""tipo_emocion"": ""insatisfacción"", ""fuente_marca"": ""tener mejores teléfonos a un mejor precio"", ""fuente_inferencia"": ""mejores teléfonos a mejor precio"", ""modo_existencia"": ""potencial"", ""tipo_configuracion"": ""ordenado_alrededor_de_verbos_psicologicos""}]",v22,,,,,2026-06-24 08:56:08,2026-07-02 22:02:50.350565+00:00
casarosada_50371-palabras-del-presidente-de-la-nacion-javier-milei-en-la-conferencia-politica-de-accion-conservadora-cpac-en-washington-estados-unidos,59,"Por lo tanto, fuera la teoría neoclásica.",[],v22,,"[{""experienciador"": ""Javier Milei"", ""experienciador_marca"": ""fuera"", ""tipo_emocion"": ""rechazo"", ""fuente_marca"": ""la teoría neoclásica"", ""fuente_inferencia"": ""la teoría neoclásica"", ""modo_existencia"": ""actual"", ""tipo_configuracion"": ""cualificacion_por_indicadores_axiologicos""}]",v22,,,,,2026-06-24 08:56:08,2026-07-02 22:02:50.350672+00:00
casarosada_50371-palabras-del-presidente-de-la-nacion-javier-milei-en-la-conferencia-politica-de-accion-conservadora-cpac-en-washington-estados-unidos,60,"Entonces, veamos dónde están esos errores de la teoría neoclásica.","[{""marca"": ""veamos"", ""actor"": ""Javier Milei"", ""tipo"": ""humano_individual"", ""modo"": ""inferido"", ""justificacion"": ""El verbo 'veamos' en primera persona del plural incluye al enunciador.""}, {""marca"": ""veamos"", ""actor"": ""Audiencia/Asistentes a la CPAC"", ""tipo"": ""colectivo"", ""modo"": ""inferido"", ""justificacion"": ""El verbo 'veamos' en primera persona del plural incluye a los oyentes en la acción.""}, {""marca"": ""teoría neoclásica"", ""actor"": ""Economistas neoclásicos"", ""tipo"": ""colectivo"", ""modo"": ""inferido"", ""justificacion"": ""La mención a 'la teoría neoclásica' permite inferir a sus proponentes o exponentes como actores responsables de dichos errores.""}]",v22,,[],v22,,,,,2026-06-24 08:56:08,2026-07-02 22:02:50.350758+00:00
casarosada_50371-palabras-del-presidente-de-la-nacion-javier-milei-en-la-conferencia-politica-de-accion-conservadora-cpac-en-washington-estados-unidos,61,En la versión más simple es porque dicen que el precio del monopolio es mayor que el de la competencia y que la cantidad producida es menor que en competencia.,"[{""marca"": ""dicen"", ""actor"": ""personas / economistas / críticos"", ""tipo"": ""colectivo"", ""modo"": ""inferido"", ""justificacion"": ""El verbo 'dicen' presenta un sujeto tácito que refiere a quienes sostienen esa tesis económica.""}]",v22,,[],v22,,,,,2026-06-24 08:56:08,2026-07-02 22:02:50.350841+00:00
casarosada_50371-palabras-del-presidente-de-la-nacion-javier-milei-en-la-conferencia-politica-de-accion-conservadora-cpac-en-washington-estados-unidos,62,"Sin embargo, ese análisis es errado porque tiene varios problemas; en primer lugar, porque es solamente un análisis de equilibrio parcial, solo considera el equilibrio en un solo mercado, y no considera el resto de la economía.",[],v22,,[],v22,,,,,2026-06-24 08:56:08,2026-07-02 22:02:50.350923+00:00
casarosada_50371-palabras-del-presidente-de-la-nacion-javier-milei-en-la-conferencia-politica-de-accion-conservadora-cpac-en-washington-estados-unidos,63,"Es decir, yo tengo el monopolio sobre Javier Milei y ustedes tienen el monopolio de ustedes mismos, sobre cada uno de ustedes, y eso no tiene nada de malo, afortunadamente somos todos distintos, gracias a Dios.","[{""marca"": ""Javier Milei"", ""actor"": ""Javier Milei"", ""tipo"": ""humano_individual"", ""modo"": ""explicito"", ""justificacion"": ""Mencionado explícitamente como sujeto sobre el cual se tiene el monopolio.""}, {""marca"": ""ustedes"", ""actor"": ""el público / los oyentes"", ""tipo"": ""colectivo"", ""modo"": ""inferido"", ""justificacion"": ""El pronombre 'ustedes' se refiere a los interlocutores presentes en la conferencia.""}, {""marca"": ""Dios"", ""actor"": ""Dios"", ""tipo"": ""humano_individual"", ""modo"": ""explicito"", ""justificacion"": ""Mencionado explícitamente como el ente responsable de la diversidad humana.""}]",v22,,"[{""experienciador"": ""Javier Milei"", ""experienciador_marca"": ""yo"", ""tipo_emocion"": ""alivio"", ""fuente_marca"": ""somos todos distintos"", ""fuente_inferencia"": ""la diversidad humana"", ""modo_existencia"": ""realizada"", ""tipo_configuracion"": ""cualificacion_por_indicadores_axiologicos""}]",v22,,,,,2026-06-24 08:56:08,2026-07-02 22:02:50.367133+00:00
casarosada_50371-palabras-del-presidente-de-la-nacion-javier-milei-en-la-conferencia-politica-de-accion-conservadora-cpac-en-washington-estados-unidos,64,"Es más, festejamos nuestras diferencias porque no nos gusta la uniformidad gris del socialismo.","[{""marca"": ""festejamos"", ""actor"": ""Javier Milei y sus simpatizantes"", ""tipo"": ""colectivo"", ""modo"": ""inferido"", ""justificacion"": ""El pronombre 'nosotros' implícito en el verbo 'festejamos' y el pronombre 'nos' refieren al enunciador y su grupo.""}, {""marca"": ""socialismo"", ""actor"": ""socialismo"", ""tipo"": ""colectivo"", ""modo"": ""explicito"", ""justificacion"": ""Se menciona explícitamente como la entidad política/ideológica que representa la uniformidad gris.""}]",v22,,"[{""experienciador"": ""Javier Milei y sus simpatizantes"", ""experienciador_marca"": ""festejamos"", ""tipo_emocion"": ""alegría"", ""fuente_marca"": ""nuestras diferencias"", ""fuente_inferencia"": ""las diferencias"", ""modo_existencia"": ""realizada"", ""tipo_configuracion"": ""ordenado_alrededor_de_verbos_psicologicos""}, {""experienciador"": ""Javier Milei y sus simpatizantes"", ""experienciador_marca"": ""nos gusta"", ""tipo_emocion"": ""aversión"", ""fuente_marca"": ""la uniformidad gris del socialismo"", ""fuente_inferencia"": ""la uniformidad gris del socialismo"", ""modo_existencia"": ""realizada"", ""tipo_configuracion"": ""ordenado_alrededor_de_verbos_psicologicos""}]",v22,,,,,2026-06-24 08:56:08,2026-07-02 22:02:50.369413+00:00
casarosada_50371-palabras-del-presidente-de-la-nacion-javier-milei-en-la-conferencia-politica-de-accion-conservadora-cpac-en-washington-estados-unidos,65,"Pero no solo está mal por ser un análisis de equilibrio parcial que no considera el resto de los mercados, sino que, además, es tan burdo que no considera los efectos futuros, es decir, el impacto en el futuro de estas estructuras de mercado.",[],v22,,"[{""experienciador"": ""Javier Milei"", ""experienciador_marca"": ""está mal"", ""tipo_emocion"": ""indignación"", ""fuente_marca"": ""un análisis de equilibrio parcial"", ""fuente_inferencia"": ""el análisis de equilibrio parcial"", ""modo_existencia"": ""actual"", ""tipo_configuracion"": ""cualificacion_por_indicadores_axiologicos""}, {""experienciador"": ""Javier Milei"", ""experienciador_marca"": ""es tan burdo"", ""tipo_emocion"": ""desprecio"", ""fuente_marca"": ""es tan burdo"", ""fuente_inferencia"": ""el análisis de equilibrio parcial"", ""modo_existencia"": ""actual"", ""tipo_configuracion"": ""cualificacion_por_indicadores_axiologicos""}]",v22,,,,,2026-06-24 08:56:08,2026-07-02 22:02:50.369555+00:00
casarosada_50371-palabras-del-presidente-de-la-nacion-javier-milei-en-la-conferencia-politica-de-accion-conservadora-cpac-en-washington-estados-unidos,66,"De hecho, esto me hace recordar un hermoso libro de un economista y pensador americano, Henry Hazlitt, que se llama, “La economía en una lección”, que decía: “La diferencia entre un buen economista y el mal economista, es que el mal economista solamente mira el mercado en un período, mientras que el buen economista mira todos los mercados y no solo el presente, sino también el futuro”.","[{""marca"": ""me"", ""actor"": ""Javier Milei"", ""tipo"": ""humano_individual"", ""modo"": ""inferido"", ""justificacion"": ""El pronombre 'me' refiere al enunciador del discurso.""}, {""marca"": ""Henry Hazlitt"", ""actor"": ""Henry Hazlitt"", ""tipo"": ""humano_individual"", ""modo"": ""explicito"", ""justificacion"": ""Se menciona explícitamente como el autor del libro.""}, {""marca"": ""el buen economista"", ""actor"": ""el buen economista"", ""tipo"": ""colectivo"", ""modo"": ""explicito"", ""justificacion"": ""Se menciona como un sujeto con un rol profesional específico.""}, {""marca"": ""el mal economista"", ""actor"": ""el mal economista"", ""tipo"": ""colectivo"", ""modo"": ""explicito"", ""justificacion"": ""Se menciona como un sujeto con un rol profesional específico.""}]",v22,,"[{""experienciador"": ""Javier Milei"", ""experienciador_marca"": ""me"", ""tipo_emocion"": ""aprecio"", ""fuente_marca"": ""un hermoso libro"", ""fuente_inferencia"": ""libro de Henry Hazlitt"", ""modo_existencia"": ""realizada"", ""tipo_configuracion"": ""cualificacion_por_indicadores_axiologicos""}]",v22,,,,,2026-06-24 08:56:08,2026-07-02 22:02:50.369665+00:00
casarosada_50371-palabras-del-presidente-de-la-nacion-javier-milei-en-la-conferencia-politica-de-accion-conservadora-cpac-en-washington-estados-unidos,67,"Por lo tanto, esto estaría mostrando que el análisis tradicional del monopolio y por el cual se los regulan, es parte de un mal análisis económico.","[{""marca"": ""se los regulan"", ""actor"": ""reguladores económicos"", ""tipo"": ""institucional"", ""modo"": ""inferido"", ""justificacion"": ""La forma verbal 'se los regulan' implica la existencia de un agente institucional que ejerce la acción de regular.""}]",v22,,"[{""experienciador"": ""Javier Milei"", ""experienciador_marca"": ""estaría mostrando"", ""tipo_emocion"": ""indignación"", ""fuente_marca"": ""el análisis tradicional del monopolio"", ""fuente_inferencia"": ""el análisis tradicional del monopolio"", ""modo_existencia"": ""actual"", ""tipo_configuracion"": ""cualificacion_por_indicadores_axiologicos""}]",v22,,,,,2026-06-24 08:56:08,2026-07-02 22:02:50.369767+00:00
casarosada_50371-palabras-del-presidente-de-la-nacion-javier-milei-en-la-conferencia-politica-de-accion-conservadora-cpac-en-washington-estados-unidos,68,"Y si, además, tomamos el rol que toman las ganancias como elemento para generar crecimiento económico, además, meterse con los beneficios implica impactar negativamente sobre el crecimiento.","[{""marca"": ""tomamos"", ""actor"": ""Javier Milei"", ""tipo"": ""humano_individual"", ""modo"": ""inferido"", ""justificacion"": ""El verbo 'tomamos' indica un sujeto inclusivo donde el enunciador es el agente principal.""}, {""marca"": ""meterse con los beneficios"", ""actor"": ""Estado / Autoridades fiscales"", ""tipo"": ""institucional"", ""modo"": ""inferido"", ""justificacion"": ""La expresión 'meterse con los beneficios' implica un actor con poder regulatorio o impositivo que interviene sobre las ganancias.""}]",v22,,[],v22,,,,,2026-06-24 08:56:08,2026-07-02 22:02:50.369860+00:00
casarosada_50371-palabras-del-presidente-de-la-nacion-javier-milei-en-la-conferencia-politica-de-accion-conservadora-cpac-en-washington-estados-unidos,69,"Entonces, la pregunta es: ¿Cuál es la verdadera respuesta, o el verdadero fundamento de este análisis?",[],v22,,[],v22,,,,,2026-06-24 08:56:08,2026-07-02 22:02:50.369949+00:00
casarosada_50371-palabras-del-presidente-de-la-nacion-javier-milei-en-la-conferencia-politica-de-accion-conservadora-cpac-en-washington-estados-unidos,70,"Y en realidad la respuesta no está en el análisis económico, está en la estructura matemática que usa el equilibrio general.",[],v22,,[],v22,,,,,2026-06-24 08:56:08,2026-07-02 22:02:50.370035+00:00
casarosada_50371-palabras-del-presidente-de-la-nacion-javier-milei-en-la-conferencia-politica-de-accion-conservadora-cpac-en-washington-estados-unidos,71,"Básicamente, tiene que ver con el análisis del óptimo de Pareto y el problema de las no convexidades en el conjunto de producción.",[],v22,,[],v22,,,,,2026-06-24 08:56:08,2026-07-02 22:02:50.370121+00:00
casarosada_50371-palabras-del-presidente-de-la-nacion-javier-milei-en-la-conferencia-politica-de-accion-conservadora-cpac-en-washington-estados-unidos,72,"El óptimo de Pareto, para que el equilibrio existente sea óptimo de Pareto, tanto los consumidores como los productores deberían estar maximizando.","[{""marca"": ""los consumidores"", ""actor"": ""consumidores"", ""tipo"": ""colectivo"", ""modo"": ""explicito"", ""justificacion"": ""El texto menciona explícitamente a 'los consumidores' como sujetos que maximizan.""}, {""marca"": ""los productores"", ""actor"": ""productores"", ""tipo"": ""colectivo"", ""modo"": ""explicito"", ""justificacion"": ""El texto menciona explícitamente a 'los productores' como sujetos que maximizan.""}]",v22,,[],v22,,,,,2026-06-24 08:56:08,2026-07-02 22:02:50.370206+00:00
casarosada_50371-palabras-del-presidente-de-la-nacion-javier-milei-en-la-conferencia-politica-de-accion-conservadora-cpac-en-washington-estados-unidos,73,Y el problema es que cuando tenemos rendimientos crecientes tenemos funciones de producción convexas y el problema con esas funciones es que no se puede encontrar un máximo.,[],v22,,[],v22,,,,,2026-06-24 08:56:08,2026-07-02 22:02:50.370291+00:00
casarosada_50371-palabras-del-presidente-de-la-nacion-javier-milei-en-la-conferencia-politica-de-accion-conservadora-cpac-en-washington-estados-unidos,74,"Naturalmente, eso es un error matemático también porque si yo tengo rendimientos crecientes puedo encontrar un máximo si utilizo todas las dotaciones de la economía y entonces ahí aparecería otro problema que me quedaría una sola empresa","[{""marca"": ""yo"", ""actor"": ""Javier Milei"", ""tipo"": ""humano_individual"", ""modo"": ""explicito"", ""justificacion"": ""El pronombre 'yo' hace referencia directa al enunciador del discurso.""}, {""marca"": ""una sola empresa"", ""actor"": ""empresa"", ""tipo"": ""institucional"", ""modo"": ""explicito"", ""justificacion"": ""El texto menciona explícitamente la entidad 'una sola empresa'.""}]",v22,,[],v22,,,,,2026-06-24 08:56:08,2026-07-02 22:02:50.370374+00:00
casarosada_50371-palabras-del-presidente-de-la-nacion-javier-milei-en-la-conferencia-politica-de-accion-conservadora-cpac-en-washington-estados-unidos,75,"pero eso que parece algo empíricamente correcto también tiene otro error conceptual porque básicamente implica desconocer la naturaleza de la firma y entre otras cosas, deja de lado el hecho de que las firmas son manejadas por seres humanos y naturalmente cuando ustedes más quieran trabajar para producir más, el costo de oportunidad del tiempo libre crece fenomenalmente.","[{""marca"": ""seres humanos"", ""actor"": ""seres humanos"", ""tipo"": ""colectivo"", ""modo"": ""explicito"", ""justificacion"": ""Mención literal de los sujetos que manejan las firmas.""}, {""marca"": ""ustedes"", ""actor"": ""ustedes"", ""tipo"": ""colectivo"", ""modo"": ""explicito"", ""justificacion"": ""Pronombre que hace referencia a los interlocutores del discurso.""}]",v22,,"[{""experienciador"": ""los asistentes a la CPAC"", ""experienciador_marca"": ""ustedes"", ""tipo_emocion"": ""deseo"", ""fuente_marca"": ""trabajar para producir más"", ""fuente_inferencia"": ""el trabajo"", ""modo_existencia"": ""potencial"", ""tipo_configuracion"": ""ordenado_alrededor_de_verbos_psicologicos""}]",v22,,,,,2026-06-24 08:56:08,2026-07-02 22:02:50.370470+00:00
casarosada_50371-palabras-del-presidente-de-la-nacion-javier-milei-en-la-conferencia-politica-de-accion-conservadora-cpac-en-washington-estados-unidos,76,De qué le serviría un trabajo de que le ofrezcan 12 millones de dólares al año si ustedes tuvieran que trabajar los 7 días de la semana 24 horas.,"[{""marca"": ""le"", ""actor"": ""persona hipotética / trabajador"", ""tipo"": ""humano_individual"", ""modo"": ""inferido"", ""justificacion"": ""El pronombre 'le' y la mención a 'un trabajo' sugieren un sujeto que recibe la oferta.""}, {""marca"": ""ofrezcan"", ""actor"": ""empleador / entidad contratante"", ""tipo"": ""institucional"", ""modo"": ""inferido"", ""justificacion"": ""El verbo 'ofrezcan' implica un agente que realiza la oferta económica.""}, {""marca"": ""ustedes"", ""actor"": ""oyentes / interlocutores"", ""tipo"": ""colectivo"", ""modo"": ""explicito"", ""justificacion"": ""El pronombre 'ustedes' identifica explícitamente al colectivo al que se dirige el enunciador.""}]",v22,,"[{""experienciador"": ""los oyentes"", ""experienciador_marca"": ""ustedes"", ""tipo_emocion"": ""angustia"", ""fuente_marca"": ""trabajar los 7 días de la semana 24 horas"", ""fuente_inferencia"": ""condiciones laborales extremas"", ""modo_existencia"": ""potencial"", ""tipo_configuracion"": ""cualificacion_por_indicadores_axiologicos""}]",v22,,,,,2026-06-24 08:56:08,2026-07-02 22:02:50.370564+00:00
casarosada_50371-palabras-del-presidente-de-la-nacion-javier-milei-en-la-conferencia-politica-de-accion-conservadora-cpac-en-washington-estados-unidos,77,Se van a chocar contra su propia humanidad.,"[{""marca"": ""Se van a chocar"", ""actor"": ""opositores / adversarios políticos"", ""tipo"": ""colectivo"", ""modo"": ""inferido"", ""justificacion"": ""El pronombre 'Se' y el verbo 'van a chocar' indican un sujeto tácito plural que actúa como agente y paciente de la acción en un contexto de confrontación política.""}]",v22,,"[{""experienciador"": ""opositores y adversarios políticos"", ""experienciador_marca"": ""Se"", ""tipo_emocion"": ""frustración"", ""fuente_marca"": ""su propia humanidad"", ""fuente_inferencia"": ""su propia condición humana"", ""modo_existencia"": ""potencial"", ""tipo_configuracion"": ""cualificacion_por_componentes_descriptivo_narrativos""}]",v22,,,,,2026-06-24 08:56:08,2026-07-02 22:02:50.370657+00:00
casarosada_50371-palabras-del-presidente-de-la-nacion-javier-milei-en-la-conferencia-politica-de-accion-conservadora-cpac-en-washington-estados-unidos,78,"Sin embargo, el análisis neoclásico trabaja a las firmas como si fueran máquina y no como empresas que dependen, son de los seres humanos.","[{""marca"": ""el análisis neoclásico"", ""actor"": ""análisis neoclásico"", ""tipo"": ""institucional"", ""modo"": ""explicito"", ""justificacion"": ""Se menciona explícitamente como el sujeto que realiza la acción de trabajar o conceptualizar.""}, {""marca"": ""las firmas"", ""actor"": ""firmas"", ""tipo"": ""institucional"", ""modo"": ""explicito"", ""justificacion"": ""Se mencionan como las entidades sobre las cuales recae el análisis.""}, {""marca"": ""empresas"", ""actor"": ""empresas"", ""tipo"": ""institucional"", ""modo"": ""explicito"", ""justificacion"": ""Se mencionan como la naturaleza real de las firmas.""}, {""marca"": ""los seres humanos"", ""actor"": ""seres humanos"", ""tipo"": ""colectivo"", ""modo"": ""explicito"", ""justificacion"": ""Se mencionan explícitamente como los sujetos de quienes dependen las empresas.""}]",v22,,[],v22,,,,,2026-06-24 08:56:08,2026-07-02 22:02:50.370758+00:00
