codigo,unit_idx,frase,actores_payload,actores_version,actores_error,emociones_payload,emociones_version,emociones_error,emociones_pass2_payload,emociones_pass2_version,emociones_pass2_error,created_at,updated_at
casarosada_50311-palabras-del-presidente-de-la-nacion-javier-milei-en-el-acto-oficial-por-el-dia-internacional-en-memoria-de-las-victimas-del-holocausto-desde-el-museo-del-holocausto-caba,29,"Las potencias del mundo se mantuvieron inertes mientras los nazis promulgaban leyes antisemitas y segregacionistas, y comenzaban a poblar los campos de concentración.","[{""marca"": ""Las potencias del mundo"", ""actor"": ""potencias del mundo"", ""tipo"": ""colectivo"", ""modo"": ""explicito"", ""justificacion"": ""Se menciona explícitamente como el sujeto que se mantuvo inerte.""}, {""marca"": ""los nazis"", ""actor"": ""nazis"", ""tipo"": ""colectivo"", ""modo"": ""explicito"", ""justificacion"": ""Se menciona explícitamente como los agentes que promulgaban leyes y poblaban campos.""}, {""marca"": ""antisemitas y segregacionistas"", ""actor"": ""personas judías / víctimas del holocausto"", ""tipo"": ""colectivo"", ""modo"": ""inferido"", ""justificacion"": ""Se infiere como el actor paciente a través de las nominalizaciones 'antisemitas', 'segregacionistas' y la acción de 'poblar los campos de concentración'.""}]",v22,,"[{""experienciador"": ""personas judías / víctimas del holocausto"", ""experienciador_marca"": ""no identificado"", ""tipo_emocion"": ""terror"", ""fuente_marca"": ""los nazis"", ""fuente_inferencia"": ""nazis"", ""modo_existencia"": ""realizada"", ""tipo_configuracion"": ""cualificacion_por_componentes_descriptivo_narrativos""}, {""experienciador"": ""personas judías / víctimas del holocausto"", ""experienciador_marca"": ""no identificado"", ""tipo_emocion"": ""desamparo"", ""fuente_marca"": ""Las potencias del mundo"", ""fuente_inferencia"": ""potencias del mundo"", ""modo_existencia"": ""realizada"", ""tipo_configuracion"": ""cualificacion_por_componentes_descriptivo_narrativos""}]",v22,,,,,2026-06-24 08:56:08,2026-07-02 21:36:43.945631+00:00
casarosada_50311-palabras-del-presidente-de-la-nacion-javier-milei-en-el-acto-oficial-por-el-dia-internacional-en-memoria-de-las-victimas-del-holocausto-desde-el-museo-del-holocausto-caba,30,"Inclusive, le cerraron las puertas a judíos exiliados que tenían que elegir entre el exilio o la tortura.","[{""marca"": ""cerraron"", ""actor"": ""Estado o autoridades del país receptor/emisor"", ""tipo"": ""institucional"", ""modo"": ""inferido"", ""justificacion"": ""El verbo 'cerraron' implica un agente con autoridad para denegar la entrada a un territorio.""}, {""marca"": ""judíos exiliados"", ""actor"": ""judíos exiliados"", ""tipo"": ""colectivo"", ""modo"": ""explicito"", ""justificacion"": ""Se menciona explícitamente como el grupo afectado por la acción.""}]",v22,,"[{""experienciador"": ""judíos exiliados"", ""experienciador_marca"": ""judíos exiliados"", ""tipo_emocion"": ""miedo"", ""fuente_marca"": ""la tortura"", ""fuente_inferencia"": ""tortura"", ""modo_existencia"": ""realizada"", ""tipo_configuracion"": ""cualificacion_por_componentes_descriptivo_narrativos""}, {""experienciador"": ""judíos exiliados"", ""experienciador_marca"": ""judíos exiliados"", ""tipo_emocion"": ""desesperanza"", ""fuente_marca"": ""le cerraron las puertas"", ""fuente_inferencia"": ""cierre de puertas"", ""modo_existencia"": ""realizada"", ""tipo_configuracion"": ""cualificacion_por_componentes_descriptivo_narrativos""}]",v22,,,,,2026-06-24 08:56:08,2026-07-02 21:36:43.945750+00:00
casarosada_50311-palabras-del-presidente-de-la-nacion-javier-milei-en-el-acto-oficial-por-el-dia-internacional-en-memoria-de-las-victimas-del-holocausto-desde-el-museo-del-holocausto-caba,31,"Hoy, muchos países del mundo libre se arrepienten de aquella actitud de silencio frente a las atrocidades de los nazis.","[{""marca"": ""muchos países del mundo libre"", ""actor"": ""países del mundo libre"", ""tipo"": ""institucional"", ""modo"": ""explicito"", ""justificacion"": ""Mencionados explícitamente como sujetos que se arrepienten.""}, {""marca"": ""los nazis"", ""actor"": ""nazis"", ""tipo"": ""colectivo"", ""modo"": ""explicito"", ""justificacion"": ""Mencionados explícitamente como autores de las atrocidades.""}, {""marca"": ""atrocidades"", ""actor"": ""víctimas del holocausto"", ""tipo"": ""colectivo"", ""modo"": ""inferido"", ""justificacion"": ""Inferido a partir de la nominalización 'atrocidades', que requiere un sujeto paciente.""}]",v22,,"[{""experienciador"": ""países del mundo libre"", ""experienciador_marca"": ""muchos países del mundo libre"", ""tipo_emocion"": ""arrepentimiento"", ""fuente_marca"": ""aquella actitud de silencio"", ""fuente_inferencia"": ""la actitud de silencio frente a los nazis"", ""modo_existencia"": ""realizada"", ""tipo_configuracion"": ""ordenado_alrededor_de_verbos_psicologicos""}]",v22,,,,,2026-06-24 08:56:08,2026-07-02 21:36:43.945955+00:00
casarosada_50311-palabras-del-presidente-de-la-nacion-javier-milei-en-el-acto-oficial-por-el-dia-internacional-en-memoria-de-las-victimas-del-holocausto-desde-el-museo-del-holocausto-caba,32,"Para que la historia no se repita, nosotros, quienes defendemos la libertad, tenemos la obligación de que eso no vuelva a ocurrir.","[{""marca"": ""nosotros, quienes defendemos la libertad"", ""actor"": ""Javier Milei y quienes defendemos la libertad"", ""tipo"": ""colectivo"", ""modo"": ""explicito"", ""justificacion"": ""El pronombre 'nosotros' y la frase 'quienes defendemos la libertad' refieren al enunciador y su grupo político.""}]",v22,,"[{""experienciador"": ""Javier Milei y quienes defendemos la libertad"", ""experienciador_marca"": ""nosotros"", ""tipo_emocion"": ""temor"", ""fuente_marca"": ""que la historia no se repita"", ""fuente_inferencia"": ""la repetición de la historia"", ""modo_existencia"": ""actual"", ""tipo_configuracion"": ""cualificacion_por_indicadores_cognitivos""}]",v22,,,,,2026-06-24 08:56:08,2026-07-02 21:36:43.946051+00:00
casarosada_50311-palabras-del-presidente-de-la-nacion-javier-milei-en-el-acto-oficial-por-el-dia-internacional-en-memoria-de-las-victimas-del-holocausto-desde-el-museo-del-holocausto-caba,33,"Sin embargo, muchos países reinciden en el mismo silencio, un silencio que aturde.","[{""marca"": ""muchos países"", ""actor"": ""muchos países"", ""tipo"": ""institucional"", ""modo"": ""explicito"", ""justificacion"": ""Se menciona explícitamente a los Estados como sujetos que reinciden en el silencio.""}]",v22,,"[{""experienciador"": ""Javier Milei"", ""experienciador_marca"": ""no identificado"", ""tipo_emocion"": ""indignación"", ""fuente_marca"": ""el mismo silencio"", ""fuente_inferencia"": ""el silencio de muchos países"", ""modo_existencia"": ""actual"", ""tipo_configuracion"": ""cualificacion_por_indicadores_cognitivos""}]",v22,,,,,2026-06-24 08:56:08,2026-07-02 21:36:43.946145+00:00
casarosada_50311-palabras-del-presidente-de-la-nacion-javier-milei-en-el-acto-oficial-por-el-dia-internacional-en-memoria-de-las-victimas-del-holocausto-desde-el-museo-del-holocausto-caba,34,"Argentina no silencia frente al terror de Hamas y exige la liberación inmediata de todos los civiles secuestrados, incluidos nuestros once compatriotas.","[{""marca"": ""Argentina"", ""actor"": ""Estado Argentino"", ""tipo"": ""institucional"", ""modo"": ""explicito"", ""justificacion"": ""La marca 'Argentina' funciona como metonimia del Estado y su gobierno.""}, {""marca"": ""Hamas"", ""actor"": ""Hamas"", ""tipo"": ""colectivo"", ""modo"": ""explicito"", ""justificacion"": ""Se menciona explícitamente como el agente del terror.""}, {""marca"": ""civiles secuestrados"", ""actor"": ""Civiles secuestrados"", ""tipo"": ""colectivo"", ""modo"": ""explicito"", ""justificacion"": ""Se menciona explícitamente como los sujetos que deben ser liberados.""}, {""marca"": ""nuestros once compatriotas"", ""actor"": ""Ciudadanos argentinos secuestrados"", ""tipo"": ""colectivo"", ""modo"": ""explicito"", ""justificacion"": ""La expresión 'nuestros once compatriotas' refiere a individuos específicos de nacionalidad argentina.""}]",v22,,"[{""experienciador"": ""Estado Argentino"", ""experienciador_marca"": ""Argentina"", ""tipo_emocion"": ""indignación"", ""fuente_marca"": ""terror de Hamas"", ""fuente_inferencia"": ""Hamas"", ""modo_existencia"": ""realizada"", ""tipo_configuracion"": ""cualificacion_por_indicadores_axiologicos""}]",v22,,,,,2026-06-24 08:56:08,2026-07-02 21:36:43.946240+00:00
casarosada_50311-palabras-del-presidente-de-la-nacion-javier-milei-en-el-acto-oficial-por-el-dia-internacional-en-memoria-de-las-victimas-del-holocausto-desde-el-museo-del-holocausto-caba,35,"En mi mandato, me comprometo a continuar trabajando con las organizaciones de la comunidad judío-argentina para lograr una sociedad más respetuosa de la diversidad cultural y religiosa.","[{""marca"": ""mi"", ""actor"": ""Javier Milei"", ""tipo"": ""humano_individual"", ""modo"": ""inferido"", ""justificacion"": ""El pronombre 'mi' y el verbo 'comprometo' refieren al enunciador del discurso.""}, {""marca"": ""organizaciones de la comunidad judío-argentina"", ""actor"": ""organizaciones de la comunidad judío-argentina"", ""tipo"": ""colectivo"", ""modo"": ""explicito"", ""justificacion"": ""Se mencionan explícitamente como entidades con las que se trabajará.""}, {""marca"": ""sociedad"", ""actor"": ""sociedad"", ""tipo"": ""colectivo"", ""modo"": ""explicito"", ""justificacion"": ""Se refiere al conjunto de personas que componen el cuerpo social mencionado.""}]",v22,,"[{""experienciador"": ""Javier Milei"", ""experienciador_marca"": ""me comprometo"", ""tipo_emocion"": ""esperanza"", ""fuente_marca"": ""una sociedad más respetuosa"", ""fuente_inferencia"": ""sociedad más respetuosa"", ""modo_existencia"": ""potencial"", ""tipo_configuracion"": ""cualificacion_por_indicadores_axiologicos""}]",v22,,,,,2026-06-24 08:56:08,2026-07-02 21:36:43.946349+00:00
casarosada_50311-palabras-del-presidente-de-la-nacion-javier-milei-en-el-acto-oficial-por-el-dia-internacional-en-memoria-de-las-victimas-del-holocausto-desde-el-museo-del-holocausto-caba,36,"Me comprometo también a fortalecer nuestro vínculo diplomático, comercial y de amistad con el Estado de Israel.","[{""marca"": ""Me comprometo"", ""actor"": ""Javier Milei"", ""tipo"": ""humano_individual"", ""modo"": ""inferido"", ""justificacion"": ""El verbo 'comprometo' en primera persona del singular refiere al enunciador del discurso.""}, {""marca"": ""Estado de Israel"", ""actor"": ""Estado de Israel"", ""tipo"": ""institucional"", ""modo"": ""explicito"", ""justificacion"": ""Se menciona explícitamente como la entidad con la cual se fortalecerá el vínculo.""}]",v22,,"[{""experienciador"": ""Javier Milei"", ""experienciador_marca"": ""Me"", ""tipo_emocion"": ""amistad"", ""fuente_marca"": ""Estado de Israel"", ""fuente_inferencia"": ""Estado de Israel"", ""modo_existencia"": ""realizada"", ""tipo_configuracion"": ""sostenido_en_sustantivos""}]",v22,,,,,2026-06-24 08:56:08,2026-07-02 21:36:43.946447+00:00
casarosada_50311-palabras-del-presidente-de-la-nacion-javier-milei-en-el-acto-oficial-por-el-dia-internacional-en-memoria-de-las-victimas-del-holocausto-desde-el-museo-del-holocausto-caba,37,"De hecho, en las próximas semanas estaré viajando a la Tierra Santa, en la que constituirá un nuevo capítulo en la fraternidad entre nuestras dos naciones.","[{""marca"": ""estaré viajando"", ""actor"": ""Javier Milei"", ""tipo"": ""humano_individual"", ""modo"": ""inferido"", ""justificacion"": ""El verbo 'estaré viajando' en primera persona del singular refiere al enunciador.""}, {""marca"": ""nuestras dos naciones"", ""actor"": ""Argentina"", ""tipo"": ""institucional"", ""modo"": ""inferido"", ""justificacion"": ""El adjetivo posesivo 'nuestras' en 'nuestras dos naciones' refiere al país del enunciador.""}, {""marca"": ""Tierra Santa"", ""actor"": ""Israel"", ""tipo"": ""institucional"", ""modo"": ""inferido"", ""justificacion"": ""La mención a 'Tierra Santa' y la referencia a 'dos naciones' en un contexto de fraternidad infiere al Estado de Israel.""}]",v22,,"[{""experienciador"": ""Argentina e Israel"", ""experienciador_marca"": ""nuestras dos naciones"", ""tipo_emocion"": ""afecto"", ""fuente_marca"": ""la fraternidad entre nuestras dos naciones"", ""fuente_inferencia"": ""el vínculo fraternal entre ambos países"", ""modo_existencia"": ""potencial"", ""tipo_configuracion"": ""sostenido_en_sustantivos""}]",v22,,,,,2026-06-24 08:56:08,2026-07-02 21:36:43.946541+00:00
casarosada_50311-palabras-del-presidente-de-la-nacion-javier-milei-en-el-acto-oficial-por-el-dia-internacional-en-memoria-de-las-victimas-del-holocausto-desde-el-museo-del-holocausto-caba,38,"Y también, en el marco de los 30 años del atentado a la AMIA, me comprometo a seguir trabajando para apoyar la justicia y poner fin a la impunidad que rodea este crimen aberrante y a la tragedia del atentado a la embajada de Israel.","[{""marca"": ""me comprometo"", ""actor"": ""Javier Milei"", ""tipo"": ""humano_individual"", ""modo"": ""inferido"", ""justificacion"": ""El verbo 'me comprometo' indica al enunciador como actor agente.""}, {""marca"": ""la justicia"", ""actor"": ""el Poder Judicial"", ""tipo"": ""institucional"", ""modo"": ""explicito"", ""justificacion"": ""La mención a 'la justicia' como entidad a apoyar remite a la institución judicial.""}, {""marca"": ""impunidad"", ""actor"": ""autores del atentado a la AMIA"", ""tipo"": ""colectivo"", ""modo"": ""inferido"", ""justificacion"": ""La nominalización 'impunidad' y la mención al 'crimen' infieren a quienes cometieron la acción y gozan de ella.""}, {""marca"": ""atentado a la AMIA"", ""actor"": ""víctimas del atentado a la AMIA"", ""tipo"": ""colectivo"", ""modo"": ""inferido"", ""justificacion"": ""El término 'atentado' implica la existencia de personas que sufrieron el ataque.""}, {""marca"": ""embajada de Israel"", ""actor"": ""Embajada de Israel"", ""tipo"": ""institucional"", ""modo"": ""explicito"", ""justificacion"": ""Se menciona explícitamente a la institución como objeto de la tragedia.""}, {""marca"": ""tragedia"", ""actor"": ""víctimas del atentado a la embajada de Israel"", ""tipo"": ""colectivo"", ""modo"": ""inferido"", ""justificacion"": ""La palabra 'tragedia' permite inferir a las personas afectadas por el evento.""}]",v22,,"[{""experienciador"": ""Javier Milei"", ""experienciador_marca"": ""me"", ""tipo_emocion"": ""indignación"", ""fuente_marca"": ""impunidad que rodea este crimen"", ""fuente_inferencia"": ""impunidad del crimen aberrante"", ""modo_existencia"": ""actual"", ""tipo_configuracion"": ""cualificacion_por_indicadores_axiologicos""}]",v22,,,,,2026-06-24 08:56:08,2026-07-02 21:36:43.946657+00:00
casarosada_50311-palabras-del-presidente-de-la-nacion-javier-milei-en-el-acto-oficial-por-el-dia-internacional-en-memoria-de-las-victimas-del-holocausto-desde-el-museo-del-holocausto-caba,39,"En este día de conmemoración y memoria, honramos a las víctimas sobrevivientes de la Shoá y ratificamos nuestro compromiso en la defensa de la libertad y el rechazo al antisemitismo.","[{""marca"": ""honramos"", ""actor"": ""Javier Milei y su gobierno"", ""tipo"": ""institucional"", ""modo"": ""inferido"", ""justificacion"": ""El verbo 'honramos' y el posesivo 'nuestro' indican un sujeto tácito que incluye al enunciador.""}, {""marca"": ""las víctimas sobrevivientes de la Shoá"", ""actor"": ""víctimas sobrevivientes de la Shoá"", ""tipo"": ""colectivo"", ""modo"": ""explicito"", ""justificacion"": ""Se menciona explícitamente como el objeto de la conmemoración.""}, {""marca"": ""nuestro"", ""actor"": ""Javier Milei y su gobierno"", ""tipo"": ""institucional"", ""modo"": ""inferido"", ""justificacion"": ""El posesivo 'nuestro' remite al grupo que asume el compromiso.""}, {""marca"": ""antisemitismo"", ""actor"": ""personas que practican el antisemitismo"", ""tipo"": ""colectivo"", ""modo"": ""inferido"", ""justificacion"": ""El sustantivo 'antisemitismo' es una nominalización que implica la existencia de agentes que ejercen dicha acción.""}]",v22,,"[{""experienciador"": ""Javier Milei y su gobierno"", ""experienciador_marca"": ""nosotros"", ""tipo_emocion"": ""rechazo"", ""fuente_marca"": ""antisemitismo"", ""fuente_inferencia"": ""el antisemitismo"", ""modo_existencia"": ""realizada"", ""tipo_configuracion"": ""cualificacion_por_indicadores_axiologicos""}, {""experienciador"": ""Javier Milei y su gobierno"", ""experienciador_marca"": ""nosotros"", ""tipo_emocion"": ""valoración positiva"", ""fuente_marca"": ""libertad"", ""fuente_inferencia"": ""la libertad"", ""modo_existencia"": ""realizada"", ""tipo_configuracion"": ""cualificacion_por_indicadores_axiologicos""}]",v22,,,,,2026-06-24 08:56:08,2026-07-02 21:36:43.946757+00:00
casarosada_50311-palabras-del-presidente-de-la-nacion-javier-milei-en-el-acto-oficial-por-el-dia-internacional-en-memoria-de-las-victimas-del-holocausto-desde-el-museo-del-holocausto-caba,40,Este museo no se trata del pasado.,[],v22,,[],v22,,,,,2026-06-24 08:56:08,2026-07-02 21:36:43.946847+00:00
casarosada_50311-palabras-del-presidente-de-la-nacion-javier-milei-en-el-acto-oficial-por-el-dia-internacional-en-memoria-de-las-victimas-del-holocausto-desde-el-museo-del-holocausto-caba,41,"Gracias a este museo y a este acto, construimos el presente y proyectamos un futuro de esperanza.","[{""marca"": ""este museo"", ""actor"": ""Museo del Holocausto"", ""tipo"": ""institucional"", ""modo"": ""explicito"", ""justificacion"": ""Se menciona explícitamente como entidad que posibilita la acción.""}, {""marca"": ""construimos"", ""actor"": ""Javier Milei y asistentes al acto"", ""tipo"": ""colectivo"", ""modo"": ""inferido"", ""justificacion"": ""El verbo 'construimos' y 'proyectamos' en primera persona del plural implica al enunciador y a los presentes.""}]",v22,,"[{""experienciador"": ""Javier Milei y asistentes al acto"", ""experienciador_marca"": ""construimos"", ""tipo_emocion"": ""esperanza"", ""fuente_marca"": ""un futuro de esperanza"", ""fuente_inferencia"": ""un futuro"", ""modo_existencia"": ""realizada"", ""tipo_configuracion"": ""sostenido_en_sustantivos""}]",v22,,,,,2026-06-24 08:56:08,2026-07-02 21:36:43.946938+00:00
casarosada_50311-palabras-del-presidente-de-la-nacion-javier-milei-en-el-acto-oficial-por-el-dia-internacional-en-memoria-de-las-victimas-del-holocausto-desde-el-museo-del-holocausto-caba,42,Shalom y libertad.,[],v22,,[],v22,,,,,2026-06-24 08:56:08,2026-07-02 21:36:43.947025+00:00
casarosada_50311-palabras-del-presidente-de-la-nacion-javier-milei-en-el-acto-oficial-por-el-dia-internacional-en-memoria-de-las-victimas-del-holocausto-desde-el-museo-del-holocausto-caba,43,Muchas gracias.,[],v22,,[],v22,,,,,2026-06-24 08:56:08,2026-07-02 21:36:43.947110+00:00
casarosada_50357-palabras-del-presidente-de-la-nacion-javier-milei-luego-de-su-visita-al-museo-del-holocausto-yad-vashe-israel,0,"Palabras del Presidente de la Nación, Javier Milei, luego de su visita al Museo del Holocausto Yad Vashem, Israel.","[{""marca"": ""Javier Milei"", ""actor"": ""Javier Milei"", ""tipo"": ""humano_individual"", ""modo"": ""explicito"", ""justificacion"": ""El texto lo nombra explícitamente como el autor de las palabras.""}, {""marca"": ""Presidente de la Nación"", ""actor"": ""Presidencia de la Nación"", ""tipo"": ""institucional"", ""modo"": ""explicito"", ""justificacion"": ""Se menciona el cargo institucional del individuo.""}, {""marca"": ""Museo del Holocausto Yad Vashem"", ""actor"": ""Museo del Holocausto Yad Vashem"", ""tipo"": ""institucional"", ""modo"": ""explicito"", ""justificacion"": ""Se menciona la institución visitada como entidad receptora de la visita.""}]",v22,,[],v22,,,,,2026-06-24 08:56:08,2026-07-02 21:42:45.947926+00:00
casarosada_50357-palabras-del-presidente-de-la-nacion-javier-milei-luego-de-su-visita-al-museo-del-holocausto-yad-vashe-israel,1,PRESIDENTE.- Buenos días.,"[{""marca"": ""PRESIDENTE"", ""actor"": ""Javier Milei"", ""tipo"": ""humano_individual"", ""modo"": ""explicito"", ""justificacion"": ""Se menciona explícitamente el cargo y el nombre del emisor en el encabezado de la unidad.""}]",v22,,[],v22,,,,,2026-06-24 08:56:08,2026-07-02 21:42:45.948035+00:00
casarosada_50357-palabras-del-presidente-de-la-nacion-javier-milei-luego-de-su-visita-al-museo-del-holocausto-yad-vashe-israel,2,Quiero compartir con ustedes una historia de Talmud.,"[{""marca"": ""Quiero"", ""actor"": ""Javier Milei"", ""tipo"": ""humano_individual"", ""modo"": ""inferido"", ""justificacion"": ""Sujeto tácito del verbo 'Quiero' en un discurso identificado como palabras del presidente.""}, {""marca"": ""ustedes"", ""actor"": ""audiencia"", ""tipo"": ""colectivo"", ""modo"": ""explicito"", ""justificacion"": ""El pronombre 'ustedes' hace referencia a las personas que escuchan el discurso.""}]",v22,,[],v22,,,,,2026-06-24 08:56:08,2026-07-02 21:42:45.948132+00:00
casarosada_50357-palabras-del-presidente-de-la-nacion-javier-milei-luego-de-su-visita-al-museo-del-holocausto-yad-vashe-israel,3,Esta historia tuvo lugar luego de la destrucción del segundo templo a manos de los romanos.,"[{""marca"": ""los romanos"", ""actor"": ""romanos"", ""tipo"": ""colectivo"", ""modo"": ""explicito"", ""justificacion"": ""El texto menciona explícitamente a 'los romanos' como los agentes de la destrucción.""}]",v22,,[],v22,,,,,2026-06-24 08:56:08,2026-07-02 21:42:45.948225+00:00
casarosada_50357-palabras-del-presidente-de-la-nacion-javier-milei-luego-de-su-visita-al-museo-del-holocausto-yad-vashe-israel,4,Se encontraban Rabí Akiva y sus colegas observando el monte del templo en ruinas y vieron a un zorro salir del lugar más santo de lo que era el templo.,"[{""marca"": ""Rabí Akiva"", ""actor"": ""Rabí Akiva"", ""tipo"": ""humano_individual"", ""modo"": ""explicito"", ""justificacion"": ""El texto menciona explícitamente a 'Rabí Akiva'.""}, {""marca"": ""sus colegas"", ""actor"": ""colegas de Rabí Akiva"", ""tipo"": ""colectivo"", ""modo"": ""explicito"", ""justificacion"": ""Se hace referencia a 'sus colegas' en relación al sujeto anterior.""}, {""marca"": ""un zorro"", ""actor"": ""zorro"", ""tipo"": ""humano_individual"", ""modo"": ""explicito"", ""justificacion"": ""Se menciona la acción de un animal ('un zorro') saliendo del templo.""}]",v22,,"[{""experienciador"": ""Rabí Akiva"", ""experienciador_marca"": ""Rabí Akiva"", ""tipo_emocion"": ""tristeza"", ""fuente_marca"": ""el monte del templo en ruinas"", ""fuente_inferencia"": ""el templo en ruinas"", ""modo_existencia"": ""realizada"", ""tipo_configuracion"": ""cualificacion_por_componentes_descriptivo_narrativos""}, {""experienciador"": ""colegas de Rabí Akiva"", ""experienciador_marca"": ""sus colegas"", ""tipo_emocion"": ""tristeza"", ""fuente_marca"": ""el monte del templo en ruinas"", ""fuente_inferencia"": ""el templo en ruinas"", ""modo_existencia"": ""realizada"", ""tipo_configuracion"": ""cualificacion_por_componentes_descriptivo_narrativos""}]",v22,,,,,2026-06-24 08:56:08,2026-07-02 21:42:45.948327+00:00
casarosada_50357-palabras-del-presidente-de-la-nacion-javier-milei-luego-de-su-visita-al-museo-del-holocausto-yad-vashe-israel,5,No podría haber una escena más desalentadora que aquella.,[],v22,,"[{""experienciador"": ""Javier Milei"", ""experienciador_marca"": ""No podría"", ""tipo_emocion"": ""desaliento"", ""fuente_marca"": ""aquella"", ""fuente_inferencia"": ""la escena en el museo"", ""modo_existencia"": ""realizada"", ""tipo_configuracion"": ""sostenido_en_adjetivos""}]",v22,,,,,2026-06-24 08:56:08,2026-07-02 21:42:45.948433+00:00
casarosada_50357-palabras-del-presidente-de-la-nacion-javier-milei-luego-de-su-visita-al-museo-del-holocausto-yad-vashe-israel,6,"Frente a esta terrible escena los rabinos lloraron en señal de duelo, pero Rabí Akiva comenzó a reír.","[{""marca"": ""los rabinos"", ""actor"": ""los rabinos"", ""tipo"": ""colectivo"", ""modo"": ""explicito"", ""justificacion"": ""Mencionado explícitamente como sujeto que realiza la acción de llorar.""}, {""marca"": ""Rabí Akiva"", ""actor"": ""Rabí Akiva"", ""tipo"": ""humano_individual"", ""modo"": ""explicito"", ""justificacion"": ""Mencionado explícitamente como sujeto que comienza a reír.""}]",v22,,"[{""experienciador"": ""los rabinos"", ""experienciador_marca"": ""los rabinos"", ""tipo_emocion"": ""dolor"", ""fuente_marca"": ""esta terrible escena"", ""fuente_inferencia"": ""la escena del Holocausto"", ""modo_existencia"": ""realizada"", ""tipo_configuracion"": ""cualificacion_por_indicadores_comportamiento""}, {""experienciador"": ""Rabí Akiva"", ""experienciador_marca"": ""Rabí Akiva"", ""tipo_emocion"": ""alegría"", ""fuente_marca"": ""esta terrible escena"", ""fuente_inferencia"": ""la escena del Holocausto"", ""modo_existencia"": ""realizada"", ""tipo_configuracion"": ""cualificacion_por_indicadores_comportamiento""}]",v22,,,,,2026-06-24 08:56:08,2026-07-02 21:42:45.948566+00:00
