dominancia,justificacion,recorte_id,experienciador,tipo_emocion
Cognoscitiva,"El orgullo se manifiesta principalmente a través de la valoración cognitiva de los logros alcanzados y la expectativa de aprendizaje futuro, sin indicios claros de manifestaciones corporales predominantes.",DISCURSO_048_FR_011,Partido político de Javier Milei y su base electoral (tipo: prodestinatario),orgullo
Cognoscitiva,"La frase expresa una expectativa positiva y una valoración esperanzadora sobre el futuro, centrada en la idea de aprendizaje continuo y en las enseñanzas que perdurarán. No se mencionan sensaciones físicas ni gestos, por lo que la emoción se manifiesta principalmente a través de juicios y evaluaciones cognitivas.",DISCURSO_048_FR_011,Partido político de Javier Milei y su base electoral (tipo: prodestinatario),esperanza
Cognoscitiva,"El discurso enfatiza la expectativa de aprendizaje continuo y el acompañamiento de las enseñanzas a lo largo de la vida, lo cual se basa en juicios y evaluaciones futuras, sin referencias a sensaciones físicas, por lo que la dominancia es cognoscitiva.",DISCURSO_048_FR_011,Partido político de Javier Milei y su base electoral (tipo: prodestinatario),optimismo
Cognoscitiva,"El discurso enfatiza la continuidad del aprendizaje y el acompañamiento de las enseñanzas a lo largo de la vida, lo que refleja juicios, evaluaciones y pensamientos sobre el futuro y el desarrollo personal. No se mencionan manifestaciones físicas ni sensaciones corporales, por lo que la dominancia se identifica como cognoscitiva.",DISCURSO_048_FR_011,Partido político de Javier Milei y su base electoral (tipo: prodestinatario),motivación
Cognoscitiva,"El discurso enfatiza la reflexión sobre el cierre de una etapa y el inicio de otra de aprendizaje continuo, lo que implica juicios, evaluaciones y pensamientos motivacionales. No se mencionan manifestaciones físicas ni sensaciones corporales, por lo que la emoción de inspiración se manifiesta principalmente en el dominio cognitivo.",DISCURSO_048_FR_011,Público general argentino (tipo: paradestinatario),inspiración
Cognoscitiva,"La emoción de esperanza se manifiesta principalmente a través de juicios y evaluaciones mentales sobre el futuro: la frase indica que, aunque termina una etapa, comienza otra de aprendizaje continuo y de enseñanzas que acompañarán la vida. No se mencionan manifestaciones físicas ni sensaciones corporales, por lo que la dominancia se ubica en el dominio cognoscitivo.",DISCURSO_048_FR_011,Público general argentino (tipo: paradestinatario),esperanza
cognoscitiva,"El discurso expresa una visión optimista sobre el futuro de los graduados, enfocándose en la idea de que seguirán aprendiendo y que esas enseñanzas los acompañarán toda la vida. Esta valoración positiva y esperanzadora se basa en juicios y evaluaciones mentales sobre el futuro, sin mencionar manifestaciones físicas o sensaciones corporales. Por lo tanto, la dominancia de la emoción identificada (optimismo) se clasifica como cognoscitiva.",DISCURSO_048_FR_011,Público general argentino (tipo: paradestinatario),optimismo
Cognoscitiva,"El orgullo expresado en el discurso se fundamenta en la valoración y reconocimiento de los logros alcanzados por los graduados, así como en la expectativa de futuros aprendizajes. No se mencionan manifestaciones físicas ni sensaciones corporales, por lo que la emoción se manifiesta principalmente a través de juicios y evaluaciones cognitivas.",DISCURSO_048_FR_011,Público general argentino (tipo: paradestinatario),orgullo
Cognoscitiva,"El discurso enfatiza la valoración de los principios y valores de los héroes emancipadores, lo que implica un juicio positivo y una evaluación de la identidad colectiva. No se menciona manifestaciones físicas ni sensaciones corporales, por lo que la emoción de orgullo se presenta principalmente en el dominio cognitivo.",DISCURSO_048_FR_012,Partido político de Javier Milei y su base electoral,Orgullo
Cognoscitiva,"El discurso enfatiza la entrega simbólica de los sables como representación de los principios y valores de los héroes emancipadores, lo que provoca una valoración cognitiva de significado histórico y moral. No se describen sensaciones físicas ni gestos corporales, por lo que la emoción de inspiración se manifiesta principalmente a través de juicios y evaluaciones mentales sobre la causa y la motivación que ello genera.",DISCURSO_048_FR_012,Partido político de Javier Milei y su base electoral,Inspiración
Cognoscitiva,"El discurso se centra en la entrega simbólica de los sables, que representan principios y valores, y en la expectativa de que la base participe activamente. No se mencionan sensaciones físicas ni gestos, sino juicios y evaluaciones sobre la importancia de los símbolos y la acción futura. Por lo tanto, la motivación se manifiesta principalmente en el ámbito cognitivo.",DISCURSO_048_FR_012,Partido político de Javier Milei y su base electoral,Motivación
Cognoscitiva,"El discurso enfatiza la valoración y reconocimiento de los principios y valores de los héroes emancipadores, lo que provoca una evaluación positiva y un sentimiento de orgullo basado en juicios y pensamientos sobre la identidad y la historia. No se menciona manifestaciones físicas explícitas, por lo que la dominancia se ubica en el ámbito cognoscitivo.",DISCURSO_048_FR_012,Público general argentino,Orgullo
Cognoscitiva,"El discurso evoca la reflexión sobre los héroes emancipadores y los valores que representan, centrándose en juicios y evaluaciones simbólicas más que en manifestaciones físicas. La referencia a la entrega de sables como símbolo de principios y valores sugiere una predominancia cognitiva en la emoción de patriotismo.",DISCURSO_048_FR_012,Público general argentino,Patriotismo
Cognoscitiva,"El discurso evoca reflexión sobre los principios y valores de los héroes emancipadores, centrándose en juicios y evaluaciones históricas y morales. No se describen manifestaciones físicas ni sensaciones corporales, por lo que la emoción de inspiración se manifiesta principalmente en el ámbito cognitivo.",DISCURSO_048_FR_012,Público general argentino,Inspiración
Cognoscitiva,"La indignación se origina principalmente en la evaluación cognitiva de una injusticia percibida: la exclusión de la oposición política de la narrativa de los héroes emancipadores. El discurso provoca juicios sobre la legitimidad y la equidad, lo que indica que la emoción se manifiesta principalmente a través de procesos mentales y evaluaciones, caracterizando una dominancia cognoscitiva.",DISCURSO_048_FR_012,Oposición política (la casta política),Indignación
Cognoscitiva,"El sentimiento de resentimiento del grupo opositor se manifiesta principalmente a través de juicios y evaluaciones sobre la falta de reconocimiento y la polarización política. La frase sugiere una entrega simbólica que el grupo percibe como insuficiente o despectiva, lo que genera una valoración negativa y una sensación de injusticia. No se observan indicios claros de manifestaciones corporales (sensaciones físicas o gestos) en el contexto proporcionado, por lo que la dominancia se clasifica como cognoscitiva.",DISCURSO_048_FR_012,Oposición política (la casta política),Resentimiento
cognoscitiva,"El sentimiento de desprecio se manifiesta principalmente a través de juicios y evaluaciones sobre la casta política, sin indicios de manifestaciones físicas o sensaciones corporales. La crítica implícita y la exaltación de valores militares generan una valoración negativa y despectiva, lo que indica una dominancia cognoscitiva.",DISCURSO_048_FR_012,Oposición política (la casta política),Desprecio
Cognoscitiva,"El orgullo se manifiesta principalmente a través de juicios y evaluaciones sobre la identidad y los logros del grupo. En el discurso se celebra el símbolo del mando como emblema de orden, valor y gloria, lo que implica una valoración positiva y un reconocimiento de la propia identidad colectiva. No se observan indicios de manifestaciones corporales explícitas, por lo que la dominancia es cognoscitiva.",DISCURSO_048_FR_013,Partido político de Javier Milei y su base electoral,orgullo
Cognoscitiva,"El sentimiento de respeto se manifiesta principalmente a través de juicios y evaluaciones sobre el símbolo del mando (el sable) y su significado para la carrera militar. La frase invita a valorar la autoridad y la tradición, lo que implica un proceso cognitivo de reconocimiento y valoración, sin evidenciar manifestaciones físicas explícitas.",DISCURSO_048_FR_013,Público general argentino,respeto
Cognoscitiva,"El sentimiento de indignación se manifiesta principalmente a través de juicios y evaluaciones morales sobre la situación política y militar descrita. No se observan indicios de manifestaciones físicas o sensaciones corporales en el discurso; la crítica se centra en la valoración de la conducta de la casta política y la defensa de la relación entre Estado y Fuerzas Armadas, lo que indica una dominancia cognoscitiva.",DISCURSO_048_FR_013,Oposición política (la casta política),indignación
Cognoscitiva,"El orgullo expresado en el discurso se fundamenta principalmente en juicios y evaluaciones sobre la identidad y los valores del partido y su base electoral. Se destaca la alineación con la Constitución y el compromiso con el servicio a la nación, lo que genera una valoración positiva y un sentido de superioridad o mérito interno. No se mencionan manifestaciones físicas, sensaciones corporales ni gestos, por lo que la dominancia de la emoción se ubica en el dominio cognoscitivo.",DISCURSO_048_FR_014,Partido político de Javier Milei y su base electoral,orgullo
cognoscitiva,"La emoción de esperanza se manifiesta principalmente a través de juicios y evaluaciones sobre el futuro, como la expectativa de estabilidad y progreso que se menciona en el discurso. No se describen manifestaciones físicas o sensaciones corporales, por lo que la dominancia se identifica como cognoscitiva.",DISCURSO_048_FR_014,Partido político de Javier Milei y su base electoral,esperanza
Cognoscitiva,"El discurso se centra en la promesa de un juramento de fidelidad y el compromiso de una vida entera de servicio, lo que implica juicios, evaluaciones y pensamientos sobre la obligación y la causa. No se mencionan manifestaciones físicas o sensaciones corporales, por lo que la emoción de motivación se manifiesta principalmente en el dominio cognitivo.",DISCURSO_048_FR_014,Partido político de Javier Milei y su base electoral,motivación
Cognoscitiva,"El discurso enfatiza el compromiso intelectual y la valoración de la Constitución y el servicio a la nación, manifestando una emoción basada en juicios, valores y decisiones de lealtad, sin indicios claros de manifestaciones corporales.",DISCURSO_048_FR_014,Público general argentino,patriotismo
Cognoscitiva,"El orgullo expresado en la frase se fundamenta en la valoración y reconocimiento de la fortaleza institucional y el compromiso con la nación, aspectos que se perciben principalmente a través de juicios y evaluaciones mentales. No se mencionan manifestaciones físicas o sensaciones corporales, por lo que la dominancia de la emoción se ubica en el dominio cognoscitivo.",DISCURSO_048_FR_014,Público general argentino,orgullo
Cognoscitiva,"La emoción de esperanza se manifiesta principalmente a través de juicios y evaluaciones sobre el futuro, como la expectativa de un futuro prometedor que surge del compromiso de los oficiales con la nación. No se mencionan manifestaciones corporales explícitas, por lo que la dominancia se identifica como cognoscitiva.",DISCURSO_048_FR_014,Público general argentino,esperanza
Cognoscitiva,"El sentimiento de resentimiento se manifiesta principalmente a través de juicios y evaluaciones sobre la crítica percibida a la casta política. No se observan indicios de manifestaciones físicas o sensaciones corporales, por lo que la dominancia se clasifica como cognoscitiva.",DISCURSO_048_FR_014,Oposición política (la casta política),resentimiento
Cognoscitiva,"El discurso se centra en conceptos abstractos de lealtad y servicio, sin mencionar sensaciones físicas. La amenaza se percibe como una evaluación de la pérdida de poder político, lo que indica predominio cognitivo.",DISCURSO_048_FR_014,Oposición política (la casta política),amenaza
Cognoscitiva,"El discurso invita a recordar valores y a internalizarlos, lo que implica juicios y evaluaciones mentales sobre la identidad y la misión del grupo. No se menciona sensaciones físicas ni gestos, por lo que la manifestación dominante es cognitiva.",DISCURSO_048_FR_015,Partido político de Javier Milei y su base electoral (tipo: prodestinatario),orgullo
Cognoscitiva,"La exhortación se centra en la internalización de valores y la memoria de los preceptos, lo que implica juicios, evaluaciones y procesos mentales. No se menciona manifestaciones físicas, por lo que la dominancia es cognoscitiva.",DISCURSO_048_FR_015,Partido político de Javier Milei y su base electoral (tipo: prodestinatario),inspiración
Cognoscitiva,"El discurso de motivación se centra en la recordación y la internalización de valores (orden, valor y gloria). Se hace énfasis en la memoria, la reflexión y la intención de seguir esos preceptos, sin mencionar manifestaciones físicas o sensaciones corporales. Por lo tanto, la emoción predominante se manifiesta principalmente a nivel cognitivo.",DISCURSO_048_FR_015,Partido político de Javier Milei y su base electoral (tipo: prodestinatario),motivación
Cognoscitiva,"El discurso invita al público a recordar y valorar los preceptos de orden, valor y gloria, lo cual implica una evaluación y reconocimiento intelectual de la identidad nacional. No se mencionan manifestaciones físicas explícitas, por lo que la emoción de orgullo se manifiesta principalmente a través de juicios y evaluaciones mentales, lo que indica una dominancia cognoscitiva.",DISCURSO_048_FR_015,Público general argentino (tipo: paradestinatario),orgullo
Cognoscitiva,"El discurso invita al público a recordar y internalizar valores, lo cual implica juicios, evaluaciones y procesos mentales internos. No se mencionan manifestaciones físicas ni sensaciones corporales, por lo que la emoción de inspiración se manifiesta principalmente en el ámbito cognitivo.",DISCURSO_048_FR_015,Público general argentino (tipo: paradestinatario),inspiración
Cognoscitiva,"El discurso invita a recordar y memorizar los preceptos, lo que implica un proceso de evaluación y reflexión mental. No se mencionan manifestaciones físicas ni sensaciones corporales, por lo que la emoción de asombro se manifiesta principalmente a nivel cognitivo.",DISCURSO_048_FR_015,Público general argentino (tipo: paradestinatario),asombro
Cognoscitiva,"El sentimiento de indignación se origina principalmente en la evaluación moral y cognitiva de la situación: la oposición percibe el discurso como una reafirmación de la relación entre el Estado y las fuerzas armadas, lo que constituye una valoración de injusticia o abuso de poder. No se menciona manifestación física explícita (como gestos o sensaciones corporales), por lo que la dominancia se atribuye a la esfera cognitiva.",DISCURSO_048_FR_015,Oposición política (la casta política) (tipo: contradestinatario),indignación
Cognoscitiva,"El resentimiento expresado por la oposición se fundamenta principalmente en la evaluación cognitiva de la injusticia percibida: la exclusión de su participación en la celebración y la imposición de valores (orden, valor y gloria) que no reconocen su presencia. No se observan indicios de manifestaciones corporales o sensaciones físicas explícitas en el discurso, por lo que la dominancia se clasifica como cognoscitiva.",DISCURSO_048_FR_015,Oposición política (la casta política) (tipo: contradestinatario),resentimiento
Cognoscitiva,"El orgullo expresado por el partido y su base electoral se basa en una valoración positiva y evaluativa de los graduados como guía para la patria. La frase ""son el norte para una vida al servicio de la patria"" implica un juicio de mérito y liderazgo, sin referencia a sensaciones corporales o gestos físicos. Por lo tanto, la emoción se manifiesta principalmente en el dominio cognoscitivo.",DISCURSO_048_FR_016,Partido político de Javier Milei y su base electoral (tipo: prodestinatario),orgullo
Cognoscitiva,"El discurso presenta a los oficiales como el ""norte"" que guía a la base electoral, lo que implica un juicio evaluativo y una intención de seguir su liderazgo. No se mencionan sensaciones físicas ni gestos, por lo que la motivación se manifiesta principalmente a nivel cognitivo, como un impulso basado en la valoración y el compromiso con la causa.",DISCURSO_048_FR_016,Partido político de Javier Milei y su base electoral (tipo: prodestinatario),motivación
cognoscitiva,"El orgullo expresado al reconocer a los militares como guías de la patria se basa principalmente en juicios y evaluaciones positivas sobre ellos y su papel. No se menciona manifestaciones físicas ni sensaciones corporales, por lo que la dominancia se identifica como cognoscitiva.",DISCURSO_048_FR_016,Público general argentino (tipo: paradestinatario),orgullo
Cognoscitiva,"El discurso motiva al público a valorar el servicio militar y a aspirar a una vida guiada por valores patrióticos, lo cual implica juicios, evaluaciones y pensamientos sobre la patria y el deber. No se mencionan manifestaciones físicas ni sensaciones corporales, por lo que la dominancia se ubica en el ámbito cognoscitivo.",DISCURSO_048_FR_016,Público general argentino (tipo: paradestinatario),inspiración
cognoscitiva,"La indignación del opositor se manifiesta principalmente a través de juicios y evaluaciones morales sobre la exaltación militar percibida como crítica a la casta política. No se indican manifestaciones físicas o sensaciones corporales, por lo que la dominancia se ubica en el dominio cognoscitivo.",DISCURSO_048_FR_016,Oposición política (la casta política) (tipo: contradestinatario),indignación
Cognoscitiva,"El miedo descrito surge de la evaluación cognitiva de la oposición política ante la exaltación del ejército, percibiendo una amenaza a su posición y a sus intereses. No se mencionan manifestaciones físicas explícitas (como aceleración del corazón o tensión muscular), por lo que la emoción se manifiesta principalmente a través de juicios y evaluaciones mentales, indicando una dominancia cognoscitiva.",DISCURSO_048_FR_016,Oposición política (la casta política) (tipo: contradestinatario),miedo
Cognoscitiva,"El discurso presenta juicios y evaluaciones sobre la capacidad de los graduados para generar orgullo, sin manifestaciones físicas explícitas, indicando predominio cognitivo.",DISCURSO_048_FR_017,Partido político de Javier Milei y su base electoral,orgullo
cognoscitiva,"El discurso expresa una expectativa futura basada en juicios y evaluaciones de confianza (“no tengo duda de que lograrán…”) sin manifestaciones físicas o sensaciones corporales. Por lo tanto, la emoción de esperanza se presenta con dominancia cognoscitiva.",DISCURSO_048_FR_017,Partido político de Javier Milei y su base electoral,esperanza
Cognoscitiva,"El discurso expresa la emoción de confianza a través de juicios y evaluaciones mentales, como la frase ""no tengo duda"", que indica una valoración interna y racional de la capacidad de los graduados. No se mencionan manifestaciones físicas, sensaciones corporales ni gestos, por lo que la dominancia se ubica en el dominio cognoscitivo.",DISCURSO_048_FR_017,Partido político de Javier Milei y su base electoral,confianza
cognoscitiva,"El discurso expresa el orgullo a través de juicios y evaluaciones (""no tengo duda"", ""lograrán que todos... estemos orgullosos""), sin mencionar manifestaciones físicas o sensaciones corporales. Por lo tanto, la dominancia de la emoción identificada es cognoscitiva.",DISCURSO_048_FR_017,Público general argentino,orgullo
Cognoscitiva,"El hablante expresa esperanza mediante juicios de confianza y expectativas futuras, sin referencias a sensaciones corporales, lo que indica una dominancia cognoscitiva.",DISCURSO_048_FR_017,Público general argentino,esperanza
Cognoscitiva,"La emoción de confianza se manifiesta principalmente a través de juicios y evaluaciones internas, como la expresión ""no tengo duda"" que indica una valoración positiva y segura sobre el futuro. No se observan indicios de manifestaciones corporales o sensaciones físicas, por lo que la dominancia se clasifica como cognoscitiva.",DISCURSO_048_FR_017,Público general argentino,confianza
Cognoscitiva,"El orgullo se manifiesta principalmente a través de juicios y evaluaciones sobre el significado histórico y la importancia de las acciones y compromisos del partido, sin indicios de manifestaciones corporales explícitas en el discurso.",DISCURSO_048_FR_018,Partido político de Javier Milei y su base electoral,orgullo
Cognoscitiva,"La expresión se centra en la valoración y la expectativa de un significado especial para las acciones futuras, lo que implica juicios y evaluaciones mentales típicos de la esperanza. No se mencionan manifestaciones físicas o sensaciones corporales, por lo que la dominancia se identifica como cognoscitiva.",DISCURSO_048_FR_018,Partido político de Javier Milei y su base electoral,esperanza
Cognoscitiva,"La emoción de curiosidad se manifiesta principalmente a través de procesos cognitivos: el hablante expresa un deseo de explorar, reflexionar y comprender el contexto histórico del país. No se observan indicios de manifestaciones corporales o sensaciones físicas, por lo que la dominancia se clasifica como cognoscitiva.",DISCURSO_048_FR_018,Público general argentino,curiosidad
Cognoscitiva,"La expresión se centra en la valoración y el significado especial de las acciones y compromisos, lo que implica un juicio cognitivo sobre el futuro y la situación histórica. No se mencionan manifestaciones físicas ni gestos, por lo que la dominancia se identifica como cognoscitiva.",DISCURSO_048_FR_018,Público general argentino,esperanza
Cognoscitiva,"El escepticismo se manifiesta principalmente a través de juicios y evaluaciones sobre la validez de la interpretación histórica. En el contexto del discurso, la oposición percibe la afirmación como una declaración de valor que cuestiona su posición, lo que genera dudas y cuestionamientos intelectuales sin indicios de manifestaciones corporales. Por lo tanto, la dominancia de la emoción es cognoscitiva.",DISCURSO_048_FR_018,Oposición política (la casta política),escepticismo
Cognoscitiva,"La incredulidad se manifiesta principalmente como una evaluación cognitiva de la afirmación del presidente, donde la oposición percibe la interpretación como improbable o falsa. No se indican manifestaciones corporales (gestos, sensaciones físicas) en el contexto, por lo que la dominancia se ubica en el ámbito cognitivo.",DISCURSO_048_FR_018,Oposición política (la casta política),incredulidad
Cognoscitiva,"El sentimiento de orgullo expresado en el discurso se basa principalmente en juicios y evaluaciones sobre el esfuerzo colectivo y los logros alcanzados: se destaca la reversión de una realidad miserable y el reconocimiento de la propia capacidad para lograrlo. No se mencionan manifestaciones físicas o sensaciones corporales, por lo que la dominancia de la emoción se identifica como cognoscitiva.",DISCURSO_048_FR_019,Partido político de Javier Milei y su base electoral (prodestinatario),orgullo
cognoscitiva,"La emoción de esperanza se manifiesta principalmente a través de juicios y evaluaciones sobre la situación futura. En el discurso se destaca la idea de que, tras un largo período de imposición de la casta política, el esfuerzo colectivo ha iniciado un proceso de reversión que se espera continúe a lo largo del año. No se mencionan sensaciones físicas ni gestos corporales, sino una valoración positiva y optimista del cambio que se está produciendo. Por lo tanto, la dominancia de la emoción identificada es cognoscitiva.",DISCURSO_048_FR_019,Partido político de Javier Milei y su base electoral (prodestinatario),esperanza
Cognoscitiva,"El sentimiento de satisfacción se expresa principalmente a través de una evaluación cognitiva del progreso logrado: el hablante reconoce que, tras un largo período de imposición de la casta política, se ha empezado a revertir la realidad miserable. No se mencionan manifestaciones físicas ni sensaciones corporales, por lo que la dominancia de la emoción se ubica en el ámbito cognoscitivo.",DISCURSO_048_FR_019,Partido político de Javier Milei y su base electoral (prodestinatario),satisfacción
Cognoscitiva,"El discurso presenta la esperanza como una evaluación mental de la situación: se reconoce una realidad miserable y se percibe la posibilidad de revertirla con esfuerzo. No se mencionan sensaciones físicas ni gestos, por lo que la emoción se manifiesta principalmente a través de juicios y expectativas cognitivas.",DISCURSO_048_FR_019,Público general argentino (paradestinatario),esperanza
cognoscitiva,"El discurso presenta una evaluación cognitiva de la situación: se reconoce que la realidad miserable impuesta por la casta política está cambiando y se ha comenzado a revertir. No se mencionan manifestaciones físicas ni sensaciones corporales asociadas al alivio, por lo que la dominancia se identifica como cognoscitiva.",DISCURSO_048_FR_019,Público general argentino (paradestinatario),alivio
