dominancia,justificacion,recorte_id,experienciador,tipo_emocion
Cognoscitiva,"El discurso evoca reverencia al referirse a la batalla de Caseros y su significado histórico, lo que implica juicios y evaluaciones de importancia y respeto. No se menciona manifestaciones físicas explícitas, por lo que la dominancia se ubica en el ámbito cognoscitivo.",DISCURSO_048_FR_027,Partido político de Javier Milei y su base electoral (prodestinatario),reverencia
Cognoscitiva,"La frase evoca la memoria de un acontecimiento histórico que ocurrió hace 172 años, lo que implica un proceso de recuerdo y valoración sentimental. No se describen manifestaciones físicas ni gestos, sino una reflexión sobre el pasado y su significado para el público. Por lo tanto, la emoción de nostalgia se manifiesta principalmente en el ámbito cognitivo, a través de juicios y evaluaciones asociadas al recuerdo del evento.",DISCURSO_048_FR_027,Partido político de Javier Milei y su base electoral (prodestinatario),nostalgia
Cognoscitiva,"El discurso hace referencia a la batalla de Caseros, un hito histórico que invita a la audiencia a valorar su significado nacional. La emoción de orgullo se manifiesta principalmente a través de juicios y evaluaciones mentales sobre la identidad y la historia del país, sin mencionar manifestaciones físicas explícitas. Por lo tanto, la dominancia se interpreta como cognoscitiva.",DISCURSO_048_FR_027,Público general argentino (paradestinatario),orgullo
Cognoscitiva,"La reverencia se manifiesta principalmente a través de juicios y evaluaciones cognitivas sobre el significado histórico del lugar y la importancia de la batalla de Caseros. El discurso invita al público a reflexionar sobre el pasado y a valorar el sitio, lo que indica una dominancia cognoscitiva de la emoción.",DISCURSO_048_FR_027,Público general argentino (paradestinatario),reverencia
Cognoscitiva,"La frase evoca un recuerdo histórico y una valoración sentimental del pasado, lo que implica juicios y evaluaciones mentales sobre el significado de la batalla de Caseros y su relevancia para la audiencia. No se menciona manifestaciones físicas ni sensaciones corporales, por lo que la dominancia se identifica como cognoscitiva.",DISCURSO_048_FR_027,Público general argentino (paradestinatario),nostalgia
Cognoscitiva,"La indignación del opositor se manifiesta principalmente a través de juicios y evaluaciones sobre la postura del discurso, percibiéndolo como una amenaza a su posición y a la relación entre el Estado y las Fuerzas Armadas. No se evidencian manifestaciones corporales explícitas en el fragmento analizado, por lo que la dominancia se considera cognoscitiva.",DISCURSO_048_FR_027,Oposición política (la casta política) (contradestinatario),indignación
Cognoscitiva,"El discurso alogia a los camaradas de armas y los llama a estar a la altura de un llamado histórico, lo que implica una evaluación positiva y un reconocimiento de la capacidad y el valor del grupo. No se mencionan manifestaciones físicas o sensaciones corporales, por lo que la emoción de orgullo se manifiesta principalmente a través de juicios y evaluaciones cognitivas.",DISCURSO_048_FR_028,Partido político de Javier Milei y su base electoral (prodestinatario),orgullo
Cognoscitiva,"El discurso motiva a los camaradas a reconocer la importancia histórica del llamado y a actuar contra la tiranía rosista, lo cual implica juicios, evaluaciones y pensamientos de compromiso y propósito, característicos de la dominancia cognoscitiva.",DISCURSO_048_FR_028,Partido político de Javier Milei y su base electoral (prodestinatario),motivación
cognoscitiva,"La emoción de determinación se manifiesta principalmente a través de juicios y evaluaciones mentales, como la decisión de ""estar a la altura"" y ""prevalecer"" frente a la tiranía. El discurso enfatiza la voluntad y el compromiso intelectual de los camaradas, lo que indica una dominancia cognoscitiva.",DISCURSO_048_FR_028,Partido político de Javier Milei y su base electoral (prodestinatario),determinación
Cognoscitiva,"El discurso de inspiración se centra en la valoración moral y la motivación intelectual: se hace un llamado a la acción, se evalúa la tiranía como injusta y se invita a los camaradas a prevalecer. No se mencionan sensaciones físicas ni gestos, por lo que la dominancia se ubica en el ámbito cognoscitivo.",DISCURSO_048_FR_028,Público general argentino (paradestinatario),inspiración
Cognoscitiva,"La emoción de esperanza se manifiesta principalmente a través de juicios y evaluaciones sobre el futuro, como la expectativa de prevalecer contra la tiranía rosista. El discurso invita a creer en un resultado positivo, lo que indica una dominancia cognoscitiva.",DISCURSO_048_FR_028,Público general argentino (paradestinatario),esperanza
Cognoscitiva,"La indignación expresada al etiquetar a la oposición como ""tiranía rosista"" se basa principalmente en juicios morales y evaluaciones críticas. No se menciona ninguna manifestación física, gesto o sensación corporal asociada a la emoción; el foco está en la valoración negativa y la crítica ética, lo que indica una dominancia cognoscitiva.",DISCURSO_048_FR_028,Oposición política (la casta política) (contradestinatario),indignación
Cognoscitiva,"El orgullo expresado en el discurso se manifiesta principalmente a través de juicios y evaluaciones: la base electoral percibe la memoria del héroe como un modelo a seguir y se siente motivada a rendir lo mejor en su servicio a la patria. No se mencionan manifestaciones físicas o sensaciones corporales, por lo que la dominancia de la emoción se ubica en el ámbito cognitivo.",DISCURSO_048_FR_029,Partido político de Javier Milei y su base electoral,orgullo
Cognoscitiva,"La frase ""que su memoria sea parte para ustedes de un ejemplo, un modelo a seguir que los motive a dar lo mejor de ustedes en su servicio a la patria"" se centra en la motivación a través de juicios y evaluaciones mentales: se invita a considerar la memoria como un modelo a seguir y a dar lo mejor en el servicio a la patria. No se mencionan sensaciones corporales ni gestos, por lo que la dominancia de la emoción motivacional se interpreta como cognoscitiva.",DISCURSO_048_FR_029,Partido político de Javier Milei y su base electoral,motivación
Cognoscitiva,"El discurso se centra en la motivación intelectual y la valoración de un modelo a seguir, utilizando verbos como ""motive"" y expresiones que implican juicio y propósito. No se mencionan sensaciones físicas ni gestos, por lo que la emoción de inspiración se manifiesta principalmente a nivel cognitivo.",DISCURSO_048_FR_029,Partido político de Javier Milei y su base electoral,inspiración
Cognoscitiva,"El discurso evoca orgullo a través de juicios y evaluaciones: se presenta la memoria del héroe como un modelo a seguir y un estímulo para mejorar el servicio a la patria. No se mencionan manifestaciones físicas ni sensaciones corporales, por lo que la emoción se manifiesta principalmente en el ámbito cognitivo.",DISCURSO_048_FR_029,Público general argentino,orgullo
Cognoscitiva,"La frase invita a reflexionar sobre la memoria como modelo a seguir y a motivar al público a dar lo mejor en su servicio a la patria, lo cual se basa principalmente en juicios, evaluaciones y pensamientos internos (cognoscitivos) más que en manifestaciones físicas o sensaciones corporales.",DISCURSO_048_FR_029,Público general argentino,inspiración
Cognoscitiva,"El sentimiento de orgullo se activa principalmente a través de juicios y evaluaciones sobre el éxito y el liderazgo que la base partidaria valora. En el discurso se enfatiza que la nación cuenta con los oficiales, lo que genera una valoración positiva y una percepción de logro. No se menciona manifestaciones físicas o sensaciones corporales, por lo que la dominancia se ubica en el dominio cognoscitivo.",DISCURSO_048_FR_030,Partido político de Javier Milei y su base electoral,Pride
Cognoscitiva,"La emoción de confianza se manifiesta principalmente a través de juicios y evaluaciones internas, como la creencia en la capacidad de los oficiales y la expectativa de que la nación cuenta con ellos. No se observan indicios de manifestaciones corporales o sensaciones físicas en el fragmento, por lo que la dominancia se clasifica como cognoscitiva.",DISCURSO_048_FR_030,Partido político de Javier Milei y su base electoral,Confidence
Cognoscitiva,"La emoción de esperanza se manifiesta principalmente a través de juicios y evaluaciones sobre el futuro positivo. En el discurso se expresa la expectativa de que la nación confíe en los oficiales egresados, lo cual implica un pensamiento optimista y una valoración positiva de lo que vendrá, sin indicios de manifestaciones corporales explícitas. Por lo tanto, la dominancia se clasifica como cognoscitiva.",DISCURSO_048_FR_030,Público general argentino,Hope
Cognoscitiva,"El discurso transmite una evaluación de confianza institucional: se afirma que la nación cuenta con los oficiales, lo que implica un juicio de seguridad y credibilidad hacia ellos. No se mencionan manifestaciones físicas ni sensaciones corporales, por lo que la dominancia se ubica en el ámbito cognoscitivo.",DISCURSO_048_FR_030,Público general argentino,Trust
Cognoscitiva,"La emoción de escepticismo se manifiesta principalmente a través de juicios y evaluaciones mentales, como la duda sobre la sinceridad de la declaración. No se observan indicios de manifestaciones físicas o sensaciones corporales en el contexto proporcionado, por lo que la dominancia se clasifica como cognoscitiva.",DISCURSO_048_FR_030,Oposición política (la casta política),Skepticism
Cognoscitiva,"La emoción de indiferencia en este contexto se manifiesta principalmente a través de una evaluación cognitiva: la oposición percibe que el mensaje no les afecta directamente y, por tanto, no genera una respuesta física ni gestual. No se observan indicios de manifestaciones corporales (como cambios en la postura, expresiones faciales o sensaciones físicas), lo que sugiere que la dominancia de la emoción se centra en el juicio y la valoración mental de la situación.",DISCURSO_048_FR_030,Oposición política (la casta política),Indifference
cognoscitiva,"La frase ""ustedes pueden contar con la nación"" expresa un compromiso de apoyo que se basa en juicios y evaluaciones de confianza hacia el partido y su base electoral. No se observan indicios de manifestaciones físicas o sensaciones corporales, por lo que la dominancia de la emoción identificada (confianza) se clasifica como cognoscitiva.",DISCURSO_048_FR_031,Partido político de Javier Milei y su base electoral,confianza
Cognoscitiva,"La emoción de esperanza se manifiesta principalmente a través de juicios y evaluaciones mentales sobre un futuro positivo. En el discurso, el mensaje de respaldo nacional (“ustedes pueden contar con la nación”) implica una expectativa favorable y una valoración positiva de lo que se espera, sin indicios de manifestaciones físicas o gestos. Por lo tanto, la dominancia es cognoscitiva.",DISCURSO_048_FR_031,Partido político de Javier Milei y su base electoral,esperanza
Cognoscitiva,"El discurso presenta una promesa de apoyo que genera una evaluación cognitiva de confianza en la nación. No se menciona manifestaciones físicas, por lo que la emoción se manifiesta principalmente en juicios y evaluaciones mentales.",DISCURSO_048_FR_031,Público general argentino,confianza
Cognoscitiva,"El mensaje ""ustedes pueden contar con la nación"" transmite seguridad a través de la confianza y el respaldo que la nación ofrece, lo cual se manifiesta principalmente en juicios y evaluaciones mentales (reconocimiento de apoyo, reducción de incertidumbre). No se describen manifestaciones físicas ni sensaciones corporales, por lo que la dominancia de la emoción es cognoscitiva.",DISCURSO_048_FR_031,Público general argentino,seguridad
Cognoscitiva,"La inseguridad del grupo opositor se origina principalmente en la evaluación cognitiva de la promesa como una amenaza a su influencia política. No se mencionan manifestaciones corporales explícitas, por lo que la dominancia se atribuye a la esfera cognitiva.",DISCURSO_048_FR_031,Oposición política (la casta política),inseguridad
Cognoscitiva,"El resentimiento se manifiesta principalmente a través de juicios y evaluaciones sobre la injusticia percibida: la oposición interpreta que la nación favorece a la oposición, lo que genera una valoración negativa y un sentimiento de agravio. No se observan indicios de manifestaciones corporales explícitas, por lo que la dominancia se clasifica como cognoscitiva.",DISCURSO_048_FR_031,Oposición política (la casta política),resentimiento
Cognoscitiva,"El orgullo se expresa principalmente a través de juicios y evaluaciones sobre la contribución de las fuerzas armadas, sin indicios de manifestaciones corporales explícitas.",DISCURSO_048_FR_032,Partido político de Javier Milei y su base electoral,orgullo
Cognoscitiva,"El sentimiento de respeto se manifiesta principalmente a través de juicios y evaluaciones verbales, como la mención pública y el reconocimiento de la labor de las fuerzas armadas. No se observan indicios de manifestaciones físicas o sensaciones corporales, por lo que la dominancia se clasifica como cognoscitiva.",DISCURSO_048_FR_032,Público general argentino,respeto
Cognoscitiva,"El discurso se centra en la evaluación de la responsabilidad y el logro de políticas, lo que implica juicios y pensamientos sobre el desempeño del partido y su base. No se mencionan manifestaciones físicas o sensaciones corporales, por lo que la dominancia de la emoción orgullo se interpreta como cognoscitiva.",DISCURSO_048_FR_033,Partido político de Javier Milei y su base electoral (prodestinatario),orgullo
Cognoscitiva,"La frase destaca la pesada responsabilidad que recae sobre el partido, lo que genera una preocupación evaluativa sobre la capacidad de cumplirla. No se mencionan manifestaciones físicas ni sensaciones corporales, por lo que la emoción de ansiedad se manifiesta principalmente a través de juicios y evaluaciones internas, indicando una dominancia cognoscitiva.",DISCURSO_048_FR_033,Partido político de Javier Milei y su base electoral (prodestinatario),ansiedad
Cognoscitiva,"La emoción de esperanza se manifiesta principalmente a través de juicios y evaluaciones sobre el futuro, como la expectativa de que la nueva generación reciba una educación en competencias y valores. No se observan indicios de manifestaciones físicas o sensaciones corporales en el contexto proporcionado, lo que indica que la dominancia es cognoscitiva.",DISCURSO_048_FR_033,Público general argentino (paradestinatario),esperanza
Cognoscitiva,"La emoción de confianza se manifiesta principalmente a través de juicios y evaluaciones sobre la capacidad y responsabilidad de las fuerzas armadas, sin indicios de manifestaciones corporales o sensaciones físicas. El discurso enfatiza la expectativa de que las fuerzas armadas cumplirán su responsabilidad, lo que genera una valoración positiva y una creencia interna, característica de la dominancia cognoscitiva.",DISCURSO_048_FR_033,Público general argentino (paradestinatario),confianza
Cognoscitiva,"La indignación del opositor se basa principalmente en la evaluación cognitiva de una injusticia percibida: la asignación de una pesada responsabilidad a las fuerzas armadas. No se menciona manifestaciones físicas ni sensaciones corporales, por lo que la dominancia se infiere como cognoscitiva.",DISCURSO_048_FR_033,Oposición política (la casta política) (contradestinatario),indignación
Cognoscitiva,"El sentimiento de resentimiento en la oposición se manifiesta principalmente a través de juicios y evaluaciones sobre la asignación de una pesada responsabilidad, percibida como injusta o desequilibrada. No se observan indicios de manifestaciones corporales explícitas (sensaciones físicas, gestos), por lo que la dominancia se ubica en el dominio cognoscitivo.",DISCURSO_048_FR_033,Oposición política (la casta política) (contradestinatario),resentimiento
Cognoscitiva,"El enunciado ""espero que los graduados los hagan sentir orgullosos"" expresa una expectativa y una valoración futura sobre la acción de los graduados. No se menciona ninguna manifestación física, gesto o sensación corporal asociada a la emoción de orgullo; la emoción se manifiesta a través de la evaluación y el pensamiento sobre el logro de los graduados. Por lo tanto, la dominancia de la emoción identificada es cognoscitiva.",DISCURSO_048_FR_034,Partido político de Javier Milei y su base electoral,orgullo
Cognoscitiva,"El discurso expresa la esperanza y la evaluación de que los graduados harán sentir orgullo, sin mencionar manifestaciones físicas o sensaciones corporales. La emoción de orgullo se presenta principalmente a través de juicios y expectativas, lo que indica una dominancia cognoscitiva.",DISCURSO_048_FR_034,Público general argentino,orgullo
Cognoscitiva,"El discurso expresa una expectativa y valoración sobre el futuro de los graduados, sin mencionar sensaciones físicas ni gestos. La emoción de orgullo se manifiesta principalmente a través de juicios y evaluaciones sobre el logro y la identidad del grupo, lo que indica una dominancia cognoscitiva.",DISCURSO_048_FR_034,Oposición política (la casta política),orgullo
Cognoscitiva,"El discurso expresa agradecimiento basado en la valoración cognitiva del apoyo recibido, sin indicios de manifestaciones corporales, por lo que la dominancia es cognoscitiva.",DISCURSO_048_FR_035,Partido político de Javier Milei y su base electoral (tipo: prodestinatario),gratitud
Cognoscitiva,"El orgullo expresado al agradecer el acompañamiento y apoyo permanente de las familias se manifiesta principalmente a través de juicios y evaluaciones sobre la fortaleza y la cohesión del grupo. No se describen manifestaciones físicas o sensaciones corporales, por lo que la dominancia de la emoción se ubica en el dominio cognitivo.",DISCURSO_048_FR_035,Partido político de Javier Milei y su base electoral (tipo: prodestinatario),orgullo
Cognoscitiva,"El discurso expresa agradecimiento y valoración de la ayuda familiar, lo que implica un juicio evaluativo y reconocimiento intelectual de la importancia del apoyo. No se menciona ninguna manifestación física, gesto o sensación corporal asociada a la emoción, por lo que la dominancia se ubica en el dominio cognoscitivo.",DISCURSO_048_FR_035,Público general argentino (tipo: paradestinatario),aprecio
cognoscitiva,"El discurso expresa un deseo positivo y una evaluación favorable (feliz navidad, planifiquen en grande), sin mencionar manifestaciones físicas o sensaciones corporales. Por lo tanto, la dominancia de la emoción identificada (felicidad) se basa principalmente en juicios y evaluaciones cognitivas.",DISCURSO_048_FR_036,Partido político de Javier Milei y su base electoral (prodestinatario),felicidad
Cognoscitiva,"El discurso expresa una expectativa positiva hacia el futuro y la planificación de metas, lo cual se basa en juicios y evaluaciones mentales sobre lo que se espera lograr. No se mencionan sensaciones físicas ni gestos, por lo que la manifestación de la emoción se centra en el ámbito cognitivo.",DISCURSO_048_FR_036,Partido político de Javier Milei y su base electoral (prodestinatario),optimismo
Cognoscitiva,"La emoción de motivación se manifiesta principalmente a través de la intención y el deseo de planificar en grande, lo cual implica juicios y evaluaciones mentales sobre el futuro. No se observan indicios de manifestaciones físicas o sensaciones corporales, por lo que la dominancia se clasifica como cognoscitiva.",DISCURSO_048_FR_036,Partido político de Javier Milei y su base electoral (prodestinatario),motivación
Cognoscitiva,"El deseo de una feliz navidad se expresa mediante una evaluación positiva y un pensamiento optimista sobre el futuro, sin indicios de manifestaciones físicas o gestos. Por lo tanto, la dominancia de la emoción identificada es cognoscitiva.",DISCURSO_048_FR_036,Público general argentino (paradestinatario),felicidad
cognoscitiva,"El optimismo se manifiesta en la expresión de deseos positivos y la invitación a planificar en grande para el próximo año, lo que implica juicios y evaluaciones futuras. No se observan indicios de manifestaciones corporales o sensaciones físicas, por lo que la dominancia se ubica en el dominio cognoscitivo.",DISCURSO_048_FR_036,Público general argentino (paradestinatario),optimismo
Cognoscitiva,"La emoción de motivación se manifiesta principalmente a través de la invitación a planificar en grande y a proyectar metas futuras, lo cual implica juicios, evaluaciones y pensamientos orientados al futuro. No se observan indicios de manifestaciones físicas o sensaciones corporales, por lo que la dominancia se clasifica como cognoscitiva.",DISCURSO_048_FR_036,Público general argentino (paradestinatario),motivación
Cognoscitiva,"El discurso expresa un deseo positivo y una valoración favorable (“feliz navidad”, “planifiquen en grande”), sin indicios de manifestaciones físicas o sensaciones corporales. La emoción de felicidad se presenta principalmente a través de juicios y evaluaciones mentales, por lo que su dominancia es cognoscitiva.",DISCURSO_048_FR_036,Oposición política (la casta política) (contradestinatario),felicidad
Cognoscitiva,"El discurso expresa una expectativa positiva y una invitación a planificar en grande, lo que indica una evaluación mental y un pensamiento optimista. No se mencionan manifestaciones físicas ni sensaciones corporales, por lo que la dominancia se ubica en el dominio cognoscitivo.",DISCURSO_048_FR_036,Oposición política (la casta política) (contradestinatario),optimismo
Cognoscitiva,"La emoción de motivación se expresa principalmente a través de la invitación a planificar en grande, lo que implica juicios, evaluaciones y pensamientos orientados al futuro. No se observan manifestaciones corporales o sensaciones físicas, por lo que la dominancia es cognoscitiva.",DISCURSO_048_FR_036,Oposición política (la casta política) (contradestinatario),motivación
Cognoscitiva,"El discurso expresa una expectativa positiva y un deseo de bienestar futuro, característico de la esperanza. No se menciona ninguna manifestación física, gesto o sensación corporal; la emoción se basa en la valoración y el pensamiento de que Dios y las fuerzas celestiales acompañarán a los presentes. Por lo tanto, la dominancia de la emoción es cognoscitiva.",DISCURSO_048_FR_037,Partido político de Javier Milei y su base electoral,hope
Cognoscitiva,"La frase expresa una invocación de bendición y acompañamiento divino, centrada en la creencia y la esperanza de una fuerza superior. No se mencionan sensaciones físicas ni gestos corporales; la emoción se manifiesta principalmente a través de juicios y evaluaciones de fe, por lo que su dominancia es cognoscitiva.",DISCURSO_048_FR_037,Partido político de Javier Milei y su base electoral,faith
Cognoscitiva,"La frase expresa una creencia y confianza en la presencia de fuerzas divinas que acompañan, lo cual se basa en juicios y evaluaciones internas (fe, esperanza, seguridad). No se describen manifestaciones físicas o sensaciones corporales, por lo que la dominancia se ubica en el dominio cognitivo.",DISCURSO_048_FR_037,Partido político de Javier Milei y su base electoral,reassurance
cognoscitiva,"La emoción de gratitud en este contexto se manifiesta principalmente a través de juicios y evaluaciones internas: el receptor reconoce la bendición y la considera un acto de benevolencia, lo que genera un sentimiento de agradecimiento basado en la valoración cognitiva del gesto. No se observan indicios claros de manifestaciones físicas o sensaciones corporales, por lo que la dominancia se clasifica como cognoscitiva.",DISCURSO_048_FR_037,Partido político de Javier Milei y su base electoral,gratitude
Cognoscitiva,"La emoción de esperanza se manifiesta principalmente a través de juicios y expectativas sobre el futuro. En el discurso se expresa un deseo de bendición y acompañamiento divino, lo cual implica una valoración positiva y una expectativa de un resultado favorable. No se observan indicios de manifestaciones físicas o gestos que sugieran una dominancia corporal, por lo que la dominancia se clasifica como cognoscitiva.",DISCURSO_048_FR_037,Público general argentino,hope
Cognoscitiva,"La emoción de ""faith"" (fe) se manifiesta principalmente a través de juicios, evaluaciones y pensamientos sobre la existencia de un poder superior y la esperanza de bendición. En el fragmento citado, la expresión ""que dios los bendiga"" y ""que las fuerzas del cielo nos acompañen"" se centra en la creencia y la expectativa de una presencia divina, sin indicios de manifestaciones físicas o sensaciones corporales. Por lo tanto, la dominancia de la emoción identificada es cognoscitiva.",DISCURSO_048_FR_037,Público general argentino,faith
Cognoscitiva,"La frase expresa una creencia y evaluación de protección divina, lo que implica un juicio interno y una expectativa de seguridad. No se menciona una manifestación física directa ni un gesto corporal, por lo que la dominancia se ubica en el ámbito cognoscitivo.",DISCURSO_048_FR_037,Público general argentino,reassurance
