dominancia,justificacion,recorte_id,experienciador,tipo_emocion
Cognoscitiva,"El enunciador evalúa la acción como ilegal e injusta, expresando juicio y sentimiento de indignación sin indicios de manifestaciones corporales.",DISCURSO_048_FR_002,Presidente Javier Milei,indignación
Cognoscitiva,"El discurso presenta juicios y evaluaciones morales (denominación de Maduro como ""dictador criminal"" y la crítica a la injusticia de la detención), sin manifestaciones físicas o sensaciones corporales explícitas, lo que indica una dominancia cognoscitiva de la emoción de indignación.",DISCURSO_048_FR_003,Presidente Javier Milei,indignación
Cognoscitiva,"El sentimiento de desprecio se manifiesta principalmente a través de juicios evaluativos: se califica a Maduro como ""dictador criminal"" y se minimiza la gravedad de la detención, lo que indica una valoración cognitiva de superioridad y desdén, sin indicios de manifestaciones corporales o sensaciones físicas.",DISCURSO_048_FR_003,Presidente Javier Milei,contempto
cognoscitiva,"El discurso expresa indignación a través de juicios morales y evaluaciones (""exigimos"", ""inmediata"", ""agotar todas las vías diplomáticas""), sin manifestaciones físicas explícitas, lo que indica una dominancia cognoscitiva.",DISCURSO_048_FR_004,Presidente Javier Milei,indignación
Cognoscitiva,"La expresión ""agotaremos todas las vías diplomáticas"" refleja un juicio deliberado, una evaluación estratégica y la intención firme de actuar, sin manifestaciones físicas explícitas. Por lo tanto, la dominancia de la emoción de determinación se ubica en el dominio cognoscitivo.",DISCURSO_048_FR_004,Presidente Javier Milei,determinación
Cognoscitiva,"La esperanza se manifiesta en la evaluación positiva y la expectativa de éxito, evidenciada por la determinación de exigir la liberación y la planificación de vías diplomáticas, sin indicios de manifestaciones corporales.",DISCURSO_048_FR_004,Presidente Javier Milei,esperanza
Cognoscitiva,"El deseo se manifiesta a través del verbo ""quiero"", una expresión verbal que indica una intención o deseo de saludar. No hay indicios de manifestaciones físicas o sensaciones corporales, por lo que la emoción se basa principalmente en un juicio o intención, lo que indica dominancia cognoscitiva.",DISCURSO_048_FR_005,Presidente Javier Milei,deseo
Cognoscitiva,"El enunciado expresa un reconocimiento y valoración de la presencia de los acompañantes, lo que implica un juicio de agradecimiento y aprecio. No se menciona ninguna manifestación física específica (gestos, expresiones faciales, sensaciones corporales), por lo que la emoción se manifiesta principalmente a nivel cognitivo.",DISCURSO_048_FR_006,Presidente Javier Milei,gratitud
cognoscitiva,"El discurso expresa reconocimiento y gratitud hacia los acompañantes, lo que implica juicios y evaluaciones de su apoyo. No se mencionan manifestaciones físicas ni sensaciones corporales, por lo que la dominancia se identifica como cognoscitiva.",DISCURSO_048_FR_006,Presidente Javier Milei,aprecio
cognoscitiva,"El enunciador evalúa la jornada como inolvidable y expresa orgullo por los participantes, lo que indica una valoración cognitiva sin indicios de manifestaciones corporales.",DISCURSO_048_FR_006,Presidente Javier Milei,orgullo
Cognoscitiva,"La expresión ""es un honor para mí"" indica una valoración y reconocimiento interno del evento, reflejando un juicio cognitivo sobre la importancia y dignidad de la ceremonia. No se menciona ninguna manifestación física o sensación corporal, por lo que la dominancia se ubica en el dominio cognoscitivo.",DISCURSO_048_FR_007,Presidente Javier Milei,honor
Cognoscitiva,"El discurso expresa felicidad a través de una evaluación positiva y un reconocimiento verbal (“mis más sinceras felicitaciones”), sin mencionar manifestaciones físicas explícitas. La emoción se manifiesta principalmente en juicios y pensamientos asociados al logro y la celebración, lo que indica una dominancia cognoscitiva.",DISCURSO_048_FR_009,Presidente Javier Milei,felicidad
Cognoscitiva,"El discurso expresa orgullo a través de la evaluación y reconocimiento del logro de los graduados, manifestado en la frase ""mis más sinceras felicitaciones"". No se mencionan sensaciones físicas ni gestos corporales, por lo que la emoción se presenta principalmente en el plano cognitivo.",DISCURSO_048_FR_009,Presidente Javier Milei,orgullo
Cognoscitiva,"El orgullo se expresa a través de la valoración positiva de la finalización de la etapa y la expectativa de aprendizaje futuro, sin mencionar sensaciones corporales o gestos; por lo tanto, la dominancia es cognoscitiva.",DISCURSO_048_FR_011,Presidente Javier Milei,orgullo
Cognoscitiva,"La expresión de esperanza se centra en la valoración positiva y la expectativa futura de aprendizaje continuo. No se menciona ninguna manifestación física ni gesto corporal; la emoción se manifiesta a través de juicios y evaluaciones mentales sobre el futuro de los graduados, lo que indica una dominancia cognoscitiva.",DISCURSO_048_FR_011,Presidente Javier Milei,esperanza
Cognoscitiva,"El discurso expresa orgullo a través de juicios y evaluaciones sobre los valores y la tradición de los héroes emancipadores, sin mencionar manifestaciones físicas o gestos. Por lo tanto, la dominancia de la emoción identificada es cognoscitiva.",DISCURSO_048_FR_012,Presidente Javier Milei,orgullo
Cognoscitiva,"La reverencia expresada en el discurso se fundamenta en juicios y evaluaciones sobre los héroes emancipadores y los valores que simbolizan los sables. No se describen manifestaciones físicas o sensaciones corporales, por lo que la emoción predomina en el ámbito cognitivo.",DISCURSO_048_FR_012,Presidente Javier Milei,reverencia
Cognoscitiva,"El sentimiento de respeto se manifiesta principalmente a través de juicios y evaluaciones sobre la importancia de los valores y la tradición militar, sin indicios de manifestaciones corporales o sensaciones físicas asociadas.",DISCURSO_048_FR_012,Presidente Javier Milei,respeto
Cognoscitiva,"La emoción de anticipación se manifiesta principalmente a través de juicios y evaluaciones mentales sobre el evento próximo, sin indicios de manifestaciones corporales explícitas en el discurso. El uso de ""en instantes"" señala una expectativa mental y una valoración cognitiva del momento que se avecina, lo que indica una dominancia cognoscitiva.",DISCURSO_048_FR_012,Presidente Javier Milei,anticipación
Cognoscitiva,"El orgullo se expresa a través de juicios y evaluaciones sobre la institución y los oficiales, resaltando la importancia del juramento y el compromiso con la nación; no se menciona manifestaciones físicas, por lo que la dominancia es cognoscitiva.",DISCURSO_048_FR_014,Presidente Javier Milei,orgullo
Cognoscitiva,"La expresión se centra en la valoración positiva y la expectativa de un futuro mejor, sin indicios de manifestaciones físicas, lo que indica una dominancia cognoscitiva.",DISCURSO_048_FR_014,Presidente Javier Milei,esperanza
Cognoscitiva,"La determinación se manifiesta principalmente a través de juicios y evaluaciones: el presidente enfatiza la fidelidad a la constitución y el compromiso de los oficiales con una vida de servicio a la nación. No se citan manifestaciones físicas ni gestos, por lo que la emoción predomina en el dominio cognoscitivo.",DISCURSO_048_FR_014,Presidente Javier Milei,determinación
Cognoscitiva,"La emoción de solemnidad se manifiesta principalmente a través de juicios y evaluaciones conscientes del presidente al presenciar la ceremonia de entrega de sables y juramentos. El discurso enfatiza el significado simbólico del juramento y el compromiso de servicio a la nación, lo que indica una valoración cognitiva de la importancia del acto más que una manifestación física evidente. Por lo tanto, la dominancia se clasifica como cognoscitiva.",DISCURSO_048_FR_014,Presidente Javier Milei,solemnidad
Cognoscitiva,"El discurso enfatiza el compromiso moral y la lealtad a la constitución, expresando juicios y evaluaciones de respeto y deber. No se describen manifestaciones físicas o sensaciones corporales, por lo que la dominancia se identifica como cognoscitiva.",DISCURSO_048_FR_014,Presidente Javier Milei,reverencia
Cognoscitiva,"El discurso enfatiza juicios y evaluaciones sobre los valores de orden, valor y gloria, resaltando la importancia del día y la tradición militar. No se mencionan manifestaciones físicas o sensaciones corporales, por lo que la emoción de orgullo se manifiesta principalmente en el ámbito cognitivo.",DISCURSO_048_FR_015,Presidente Javier Milei,orgullo
Cognoscitiva,"La emoción de esperanza se manifiesta principalmente a través de la instrucción cognitiva de recordar y grabar en la memoria los preceptos, lo que implica juicios, evaluaciones y pensamientos internos más que manifestaciones físicas.",DISCURSO_048_FR_015,Presidente Javier Milei,esperanza
Cognoscitiva,"La emoción de determinación se manifiesta principalmente a través de juicios, evaluaciones y la intención de que los oficiales mantengan los principios de orden, valor y gloria. En el discurso no se observan indicios de manifestaciones corporales (gestos, sensaciones físicas) que sugieran una predominancia corporal; la referencia se centra en la voluntad y el mandato mental de recordar y grabar, lo que indica una dominancia cognoscitiva.",DISCURSO_048_FR_015,Presidente Javier Milei,determinación
Cognoscitiva,"El discurso enfatiza la importancia histórica y la necesidad de recordar el día, lo que implica juicios y evaluaciones mentales sobre su significado. No se mencionan manifestaciones físicas o sensaciones corporales, por lo que la emoción de reverencia se manifiesta principalmente en el dominio cognitivo.",DISCURSO_048_FR_015,Presidente Javier Milei,reverencia
Cognoscitiva,"El orgullo expresado por el presidente se fundamenta en una valoración positiva y una apreciación intelectual de las fuerzas armadas como guía norte para una vida de servicio a la patria. No se observan indicios de manifestaciones físicas o sensaciones corporales, por lo que la dominancia se ubica en el ámbito cognoscitivo.",DISCURSO_048_FR_016,Presidente Javier Milei,orgullo
Cognoscitiva,"El discurso expresa una valoración y juicio sobre la dirección y el propósito de la vida en servicio a la patria, sin mencionar manifestaciones físicas o sensaciones corporales. Por lo tanto, la emoción de patriotismo se manifiesta principalmente en el ámbito cognitivo.",DISCURSO_048_FR_016,Presidente Javier Milei,patriotismo
Cognoscitiva,"La expresión ""son el norte para una vida al servicio de la patria"" refleja una decisión firme y un compromiso mental de seguir esa dirección, caracterizando la determinación principalmente como un juicio o evaluación interna, sin indicios explícitos de manifestaciones corporales.",DISCURSO_048_FR_016,Presidente Javier Milei,determinación
cognoscitiva,"La expresión ""no tengo duda"" refleja un juicio interno de certeza y confianza, sin indicios de manifestaciones físicas o sensaciones corporales. Por lo tanto, la dominancia de la emoción es cognoscitiva.",DISCURSO_048_FR_017,Presidente Javier Milei,confianza
cognoscitiva,"La expresión de esperanza se manifiesta a través de una expectativa futura y un juicio positivo sobre el resultado (que los graduados harán que los argentinos se sientan orgullosos). No se observan indicios de manifestaciones corporales o sensaciones físicas; la emoción se basa principalmente en la evaluación y el pensamiento, lo que indica una dominancia cognoscitiva.",DISCURSO_048_FR_017,Presidente Javier Milei,esperanza
Cognoscitiva,"El enunciado muestra una evaluación cognitiva del momento histórico, reconociendo su significado especial y generando orgullo basado en juicios y pensamientos sobre la importancia del país, sin indicios de manifestaciones corporales.",DISCURSO_048_FR_018,Presidente Javier Milei,orgullo
Cognoscitiva,"La expresión de responsabilidad se manifiesta principalmente a través de juicios y evaluaciones sobre la importancia del momento histórico y la necesidad de actuar con compromiso. No se observan indicios de manifestaciones corporales o sensaciones físicas, por lo que la dominancia se clasifica como cognoscitiva.",DISCURSO_048_FR_018,Presidente Javier Milei,responsabilidad
Cognoscitiva,"El discurso expresa indignación al afirmar que la casta política impuso una realidad miserable a los argentinos, lo cual implica un juicio evaluativo de injusticia y una reflexión sobre la situación. No se mencionan manifestaciones físicas o sensaciones corporales, por lo que la emoción se manifiesta principalmente en el dominio cognitivo.",DISCURSO_048_FR_019,Presidente Javier Milei,indignación
Cognoscitiva,"El discurso de Milei expresa frustración al evaluar la prolongada imposición de una realidad miserable por parte de la casta política. La manifestación de la emoción se centra en juicios y evaluaciones cognitivas sobre la duración y la injusticia de la situación, sin indicios explícitos de manifestaciones corporales o sensaciones físicas. Por lo tanto, la dominancia de la emoción identificada es cognoscitiva.",DISCURSO_048_FR_019,Presidente Javier Milei,frustración
Cognoscitiva,"El enunciado expresa esperanza a través de una evaluación cognitiva de la situación: se reconoce que la realidad miserable impuesta por la casta política está siendo revertida con esfuerzo. No se mencionan manifestaciones físicas ni sensaciones corporales, por lo que la emoción se manifiesta principalmente en juicios y pensamientos.",DISCURSO_048_FR_019,Presidente Javier Milei,esperanza
Cognoscitiva,"El discurso enfatiza el esfuerzo colectivo y la acción deliberada para revertir una realidad percibida como miserable, lo que indica una evaluación y decisión mental de cambiar la situación. No se mencionan manifestaciones físicas ni sensaciones corporales, por lo que la dominancia se ubica en el ámbito cognoscitivo.",DISCURSO_048_FR_019,Presidente Javier Milei,determinación
Cognoscitiva,"El enunciado expresa una fuerte valoración moral y juicio crítico al describir los legados de la casta como ""nefastos"" y al señalar que han fracturado la relación con las fuerzas armadas. No se menciona ninguna manifestación física, sensación corporal ni gesto, por lo que la emoción de indignación se manifiesta principalmente a través de juicios y evaluaciones cognitivas.",DISCURSO_048_FR_020,Presidente Javier Milei,indignación
Cognoscitiva,"La frase expresa una evaluación crítica y un juicio sobre la acción de la casta, señalando que ha fracturado la relación entre la política y las fuerzas armadas. No se mencionan manifestaciones físicas ni sensaciones corporales, por lo que la emoción de ira se manifiesta principalmente a través de la cognición (juicio, valoración y crítica).",DISCURSO_048_FR_020,Presidente Javier Milei,ira
Cognoscitiva,"El discurso se centra en juicios y evaluaciones críticas sobre la hipocresía y la injusticia percibida, sin mencionar manifestaciones físicas o sensaciones corporales. La indignación se expresa principalmente a través de la valoración de la conducta de los demás y la consecuencia negativa para el desarrollo militar, lo que indica una dominancia cognoscitiva.",DISCURSO_048_FR_021,Presidente Javier Milei,Indignación
Cognoscitiva,"El enunciado expresa frustración a través de una evaluación cognitiva: el hablante lamenta la pérdida de años valiosos en el desarrollo militar, calificando la acción de la casta política como causa de esa pérdida. No se mencionan manifestaciones físicas o sensaciones corporales, por lo que la dominancia se identifica como cognoscitiva.",DISCURSO_048_FR_021,Presidente Javier Milei,Frustración
Cognoscitiva,"El discurso expresa un juicio crítico y evaluativo sobre la conducta de los interlocutores, señalando que su desprestigio de las fuerzas causó pérdidas de tiempo y recursos. No se menciona ninguna manifestación física o sensación corporal, por lo que la emoción de resentimiento se manifiesta principalmente a través de la cognición (juicios, evaluaciones e interpretaciones).",DISCURSO_048_FR_021,Presidente Javier Milei,Resentimiento
Cognoscitiva,"El discurso menciona la pérdida de años valiosos y la falta de apoyo político, lo que implica una valoración negativa y una evaluación de resultados. No se hace referencia a sensaciones físicas, por lo que la emoción se manifiesta principalmente en juicios y evaluaciones, lo que indica dominancia cognoscitiva.",DISCURSO_048_FR_021,Presidente Javier Milei,Decepción
Cognoscitiva,"El presidente expresa alivio mediante la valoración positiva de que el afecto persistente no fue destruido, usando la expresión 'por suerte', lo cual indica una evaluación cognitiva de la situación, sin indicios de manifestaciones corporales.",DISCURSO_048_FR_022,Presidente Javier Milei,Alivio
Cognoscitiva,"El enunciado expresa orgullo a través de juicios y evaluaciones sobre el respeto y reconocimiento que merecen las fuerzas, sin indicios de manifestaciones corporales, por lo que la dominancia es cognoscitiva.",DISCURSO_048_FR_023,Presidente Javier Milei,Orgullo
cognoscitiva,"La frase expresa una expectativa positiva sobre el futuro y una valoración favorable de las acciones y resultados, lo que indica que la emoción de esperanza se manifiesta principalmente a través de juicios, evaluaciones y pensamientos, característicos de la dominancia cognoscitiva.",DISCURSO_048_FR_023,Presidente Javier Milei,Esperanza
Cognoscitiva,"El discurso enfatiza la evaluación mental de superar una etapa triste y comenzar una nueva, sin mencionar manifestaciones físicas. La emoción de alivio se presenta principalmente como un juicio positivo sobre el cambio de situación, lo que indica dominancia cognoscitiva.",DISCURSO_048_FR_023,Presidente Javier Milei,Alivio
Cognoscitiva,"El enunciado muestra una intención y juicio de acción futura, sin indicios de manifestaciones corporales, por lo que la dominancia es cognoscitiva.",DISCURSO_048_FR_023,Presidente Javier Milei,Determinación
Cognoscitiva,"El optimismo expresado en el discurso se basa principalmente en juicios y evaluaciones positivas sobre el futuro (“estamos dando vuelta esta triste página…comenzamos a escribir una nueva”), sin indicios de manifestaciones físicas o gestos. Por lo tanto, la dominancia de la emoción es cognoscitiva.",DISCURSO_048_FR_023,Presidente Javier Milei,Optimismo
Cognoscitiva,"La expresión de satisfacción se centra en la valoración y reconocimiento de un logro político: ""estamos dando vuelta esta triste página"" y ""nuestras fuerzas tienen el respeto y el reconocimiento que se merecen"". No se menciona ninguna manifestación física o sensorial, por lo que la emoción se manifiesta principalmente a través de juicios y evaluaciones cognitivas.",DISCURSO_048_FR_023,Presidente Javier Milei,Satisfacción
Cognoscitiva,"El sentimiento de orgullo se manifiesta principalmente a través de juicios y evaluaciones internas sobre la acción de reconciliar las fuerzas armadas con la política. No se observan indicios de manifestaciones físicas o gestos que sugieran una dominancia corporal; la emoción se centra en la valoración positiva y el reconocimiento de un logro, lo que indica una dominancia cognoscitiva.",DISCURSO_048_FR_024,Presidente Javier Milei,orgullo
Cognoscitiva,"La frase expresa una valoración positiva y una percepción de logro por parte del presidente, lo que indica que la emoción de satisfacción se manifiesta principalmente a través de juicios y evaluaciones cognitivas, sin indicios de manifestaciones corporales explícitas en el contexto proporcionado.",DISCURSO_048_FR_024,Presidente Javier Milei,satisfacción
Cognoscitiva,"La frase expresa una expectativa positiva y una valoración favorable del futuro, sin indicios de manifestaciones físicas, lo que indica que la emoción de esperanza se manifiesta principalmente a nivel cognitivo.",DISCURSO_048_FR_024,Presidente Javier Milei,esperanza
Cognoscitiva,"El optimismo se manifiesta en la valoración positiva y la expectativa de mejora que el presidente expresa al afirmar que se están reconcilando las fuerzas armadas con la política. No se mencionan manifestaciones físicas ni gestos, por lo que la emoción se basa principalmente en juicios y evaluaciones cognitivas.",DISCURSO_048_FR_024,Presidente Javier Milei,optimismo
Cognoscitiva,"El discurso expresa una evaluación de confianza en la capacidad del gobierno para apoyar y jerarquizar las fuerzas, lo que implica un juicio y una creencia interna. No se mencionan manifestaciones físicas ni sensaciones corporales, por lo que la dominancia se ubica en el dominio cognoscitivo.",DISCURSO_048_FR_025,Presidente Javier Milei,confianza
cognoscitiva,"La frase ""hará todo lo que esté a su alcance"" refleja una actitud de compromiso y decisión basada en juicios y planes futuros, sin indicios de manifestaciones físicas o sensaciones corporales. Por lo tanto, la dominancia de la emoción de determinación se interpreta como cognoscitiva.",DISCURSO_048_FR_025,Presidente Javier Milei,determinación
Cognoscitiva,"El orgullo se expresa principalmente mediante juicios y evaluaciones sobre el legado militar (""honrando el legado que nos dejaron Roca y San Martín""), sin indicios de manifestaciones corporales explícitas, lo que indica una dominancia cognoscitiva.",DISCURSO_048_FR_025,Presidente Javier Milei,orgullo
Cognoscitiva,"El discurso expresa una expectativa positiva sobre el futuro y una valoración favorable de las acciones que el gobierno realizará, lo que indica una evaluación mental y una proyección de resultados esperanzadores. No se mencionan sensaciones físicas ni gestos corporales, por lo que la emoción de esperanza se manifiesta principalmente en el dominio cognitivo.",DISCURSO_048_FR_025,Presidente Javier Milei,esperanza
Cognoscitiva,"El discurso expresa optimismo a través de juicios y expectativas positivas sobre el futuro: se habla de un gobierno que acompañará y hará todo lo posible para apoyar a los egresados, resaltando la idea de un resultado favorable y de honrar un legado. No se mencionan manifestaciones físicas ni sensaciones corporales, por lo que la emoción se manifiesta principalmente en la evaluación cognitiva de la situación.",DISCURSO_048_FR_025,Presidente Javier Milei,optimismo
Cognoscitiva,"El discurso expresa preocupación mediante juicios y evaluaciones sobre los desafíos que enfrenta la patria, indicando la necesidad de preparación y responsabilidad. No se mencionan manifestaciones físicas ni sensaciones corporales, por lo que la dominancia de la emoción es cognoscitiva.",DISCURSO_048_FR_026,Presidente Javier Milei,concern
Cognoscitiva,"El discurso enfatiza la necesidad de decisiones, coraje y responsabilidad, lo que refleja un proceso cognitivo de evaluación y compromiso. No se mencionan manifestaciones físicas, por lo que la dominancia de la emoción de determinación se interpreta como cognoscitiva.",DISCURSO_048_FR_026,Presidente Javier Milei,determination
Cognoscitiva,"El enunciador expresa orgullo al recordar la batalla de Caseros, un hito histórico argentino, lo que implica una valoración cognitiva de la identidad nacional y la historia, sin indicios de manifestaciones corporales explícitas.",DISCURSO_048_FR_027,Presidente Javier Milei,orgullo
Cognoscitiva,"El sentimiento de respeto se manifiesta principalmente a través de juicios y evaluaciones verbales (la referencia a la batalla de Caseros como lugar de conmemoración), sin indicios de manifestaciones corporales o gestos. Por lo tanto, la dominancia de la emoción identificada es cognoscitiva.",DISCURSO_048_FR_027,Presidente Javier Milei,respet
Cognoscitiva,"El discurso enfatiza la valoración mental de la actuación de los camaradas, al referirse a un ""llamado histórico"" y a la necesidad de ""estar a la altura"" y ""prevalecer"". Estas expresiones reflejan juicios de mérito y logro, típicos de la dominancia cognoscitiva, más que manifestaciones físicas explícitas.",DISCURSO_048_FR_028,Presidente Javier Milei,orgullo
cognoscitiva,"La frase expresa una firme intención y voluntad de vencer, reflejando juicios y evaluaciones de la situación (prevalecer contra la tiranía rosista). Aunque implica acción, la predominancia se centra en el aspecto cognitivo de la determinación, es decir, la decisión y el compromiso mental del orador.",DISCURSO_048_FR_028,Presidente Javier Milei,determinación
cognoscitiva,"La indignación expresada por el presidente se fundamenta en juicios y evaluaciones sobre la injusticia de la ""tiranía rosista"", sin indicios de manifestaciones corporales o sensaciones físicas. Por lo tanto, la dominancia de la emoción es cognoscitiva.",DISCURSO_048_FR_028,Presidente Javier Milei,indignación
Cognoscitiva,"El discurso expresa una expectativa positiva y una valoración motivacional: ""motive a dar lo mejor"" y la idea de que la memoria sea un modelo a seguir. Estas expresiones reflejan juicios y evaluaciones mentales sobre el futuro, sin indicios de manifestaciones físicas o sensaciones corporales. Por lo tanto, la dominancia de la emoción de esperanza se interpreta como cognoscitiva.",DISCURSO_048_FR_029,Presidente Javier Milei,esperanza
Cognoscitiva,"El enunciado expresa una valoración positiva y una expectativa de desempeño de los oficiales egresados, lo que indica un juicio de confianza y creencia en su capacidad. No se mencionan manifestaciones físicas ni gestos, por lo que la emoción se manifiesta principalmente a nivel cognitivo.",DISCURSO_048_FR_030,Presidente Javier Milei,confianza
