dominancia,justificacion,recorte_id,experienciador,tipo_emocion
Cognoscitiva,"El enunciado expresa una evaluación de confianza en la capacidad de la nación, basada en juicios de seguridad y respaldo. No se menciona manifestación física ni gestos, por lo que la emoción se manifiesta principalmente en el dominio cognitivo.",DISCURSO_048_FR_031,Presidente Javier Milei,confianza
Cognoscitiva,"El discurso expresa gratitud mediante un reconocimiento verbal y una valoración de la contribución de las fuerzas armadas. No se menciona ninguna manifestación física, gesto o sensación corporal; la emoción se basa en juicios y evaluaciones (aprecio, reconocimiento), lo que indica una dominancia cognoscitiva.",DISCURSO_048_FR_032,Presidente Javier Milei,gratitud
Cognoscitiva,"El sentimiento de respeto se manifiesta principalmente a través de juicios y evaluaciones verbales, como la mención y reconocimiento de la labor de las fuerzas armadas. No se describen manifestaciones físicas ni gestos corporales, por lo que la dominancia se ubica en el dominio cognoscitivo.",DISCURSO_048_FR_032,Presidente Javier Milei,respeto
Cognoscitiva,"El discurso expresa orgullo a través de la valoración y reconocimiento de la contribución de las fuerzas armadas a la formación de nuevos oficiales. No se mencionan manifestaciones físicas ni sensaciones corporales, sino un juicio evaluativo y un sentimiento de logro y reconocimiento, lo que indica una dominancia cognoscitiva de la emoción.",DISCURSO_048_FR_032,Presidente Javier Milei,orgullo
Cognoscitiva,"El discurso expresa admiración mediante reconocimiento y valoración de la labor de las fuerzas armadas, sin indicios de manifestaciones físicas o sensaciones corporales, lo que indica una dominancia cognoscitiva.",DISCURSO_048_FR_032,Presidente Javier Milei,admiración
cognoscitiva,"El enunciado expresa un deseo futuro y una expectativa positiva sobre el resultado de los graduados, sin mencionar sensaciones físicas ni gestos. La emoción de esperanza se manifiesta principalmente a través de juicios y evaluaciones mentales sobre un posible futuro favorable, lo que indica una dominancia cognoscitiva.",DISCURSO_048_FR_034,Presidente Javier Milei,esperanza
cognoscitiva,"La expresión de gratitud se manifiesta a través de un reconocimiento verbal y una valoración positiva del apoyo recibido, sin indicios de manifestaciones físicas o gestos. Por lo tanto, la emoción predominante se basa en juicios y evaluaciones cognitivas.",DISCURSO_048_FR_035,Presidente Javier Milei,gratitud
Cognoscitiva,"El enunciado expresa un deseo positivo y una evaluación favorable (una feliz navidad y planes grandes), sin indicios de manifestaciones físicas o sensaciones corporales. La emoción de felicidad se presenta principalmente a través de juicios y pensamientos positivos, lo que indica una dominancia cognoscitiva.",DISCURSO_048_FR_036,Presidente Javier Milei,felicidad
Cognoscitiva,"El discurso expresa una expectativa positiva y una invitación a planificar en grande para el próximo año, lo que indica una evaluación mental y una valoración futura favorable. No se mencionan manifestaciones físicas ni gestos, por lo que la emoción se manifiesta principalmente a nivel cognitivo.",DISCURSO_048_FR_036,Presidente Javier Milei,optimismo
cognoscitiva,"La expresión de esperanza se manifiesta a través de un deseo verbal y una expectativa mental sobre la bendición divina y la presencia de fuerzas celestiales. No se describen sensaciones físicas ni gestos corporales asociados, por lo que la emoción se basa principalmente en juicios y pensamientos, lo que indica una dominancia cognoscitiva.",DISCURSO_048_FR_037,Presidente Javier Milei,esperanza
Cognoscitiva,"La emoción de confianza se manifiesta principalmente a través de juicios y evaluaciones internas, como la creencia en la intervención divina y la expectativa de que las fuerzas del cielo acompañen. No se describen manifestaciones físicas o gestos que indiquen una predominancia corporal, por lo que la dominancia se clasifica como cognoscitiva.",DISCURSO_048_FR_037,Presidente Javier Milei,confianza
cognoscitiva,"El enunciador expresa ""muchas gracias"", una manifestación explícita de gratitud que se basa en juicios y evaluaciones de agradecimiento hacia el público, sin indicios de manifestaciones físicas o sensaciones corporales. Por lo tanto, la dominancia de la emoción identificada es cognoscitiva.",DISCURSO_048_FR_038,Presidente Javier Milei,gratitud
cognoscitiva,"El discurso expresa alegría y celebración a través de palabras como ""felicidades a todos"" y ""¡viva la patria!"", sin mencionar manifestaciones físicas o sensaciones corporales. Por lo tanto, la dominancia de la emoción identificada (felicidad) se basa principalmente en juicios y evaluaciones cognitivas.",DISCURSO_048_FR_038,Presidente Javier Milei,felicidad
Cognoscitiva,"El discurso expresa un juicio positivo y una evaluación de la patria con la exclamación '¡viva la patria!', sin indicios de manifestaciones corporales, por lo que la dominancia se interpreta como cognoscitiva.",DISCURSO_048_FR_038,Presidente Javier Milei,orgullo
cognoscitiva,"La emoción de orgullo se manifiesta principalmente a través de juicios y evaluaciones sobre la identidad y el logro del grupo. En el contexto del discurso, el saludo inclusivo y la presencia del presidente generan un sentimiento de orgullo basado en la valoración positiva de la comunidad partidaria, sin indicios de manifestaciones físicas o sensaciones corporales explícitas. Por lo tanto, la dominancia se clasifica como cognoscitiva.",DISCURSO_048_FR_001,Partido político de Javier Milei y su base electoral,orgullo
Cognoscitiva,"El saludo ""buenas tardes a todos"" es una expresión verbal que implica un juicio social de bienvenida y acogida. No se menciona ninguna manifestación física, gesto o sensación corporal asociada; la emoción se basa principalmente en la evaluación cognitiva de la situación y la intención de incluir a la audiencia. Por lo tanto, la dominancia se clasifica como cognoscitiva.",DISCURSO_048_FR_001,Público general argentino,bienvenida
Cognoscitiva,El saludo neutro del presidente no presenta manifestaciones físicas ni gestos que indiquen una respuesta corporal; la emoción de indiferencia se basa en la evaluación cognitiva de la falta de contenido emotivo y la neutralidad del gesto.,DISCURSO_048_FR_001,Oposición política (la casta política),indiferencia
Cognoscitiva,"La indignación expresada se centra en la evaluación moral y el juicio de injusticia ante el secuestro ilegal, manifestándose principalmente a través de pensamientos y evaluaciones críticas del acto, lo que indica una dominancia cognoscitiva.",DISCURSO_048_FR_002,prodestinatario,indignación
Cognoscitiva,"El discurso menciona el secuestro ilegal de Nahuel Gallo y expresa solidaridad con la víctima, lo que implica una evaluación cognitiva de la injusticia y la empatía hacia la víctima. No se describen manifestaciones físicas, gestos ni sensaciones corporales asociadas a la emoción, por lo que la dominancia se infiere como cognoscitiva.",DISCURSO_048_FR_002,prodestinatario,solidaridad
Cognoscitiva,"El discurso expresa indignación al condenar un secuestro ilegal, lo que implica un juicio moral y una evaluación de la injusticia, predominando así la dimensión cognitiva de la emoción.",DISCURSO_048_FR_002,paradestinatario,indignación
Cognoscitiva,"El discurso se centra en la evaluación de un riesgo potencial (el secuestro ilegal de Nahuel Gallo en Venezuela) y la preocupación por la seguridad de ciudadanos argentinos en el extranjero. No se mencionan manifestaciones físicas ni gestos, sino que la emoción se expresa a través de juicios y evaluaciones sobre la situación, lo que indica una dominancia cognoscitiva.",DISCURSO_048_FR_002,paradestinatario,preocupación
Cognoscitiva,"El discurso expresa una evaluación crítica y condenatoria del secuestro ilegal, lo que indica una predominancia de juicios y evaluaciones mentales típicos de la indignación. No se observan indicios de manifestaciones corporales explícitas en el contexto proporcionado.",DISCURSO_048_FR_002,contradestinatario,indignación
Cognoscitiva,"El discurso se centra en la condena del secuestro ilegal y la anticipación de una respuesta defensiva por parte de la oposición, lo que implica juicios, evaluaciones y pensamientos críticos. No se mencionan manifestaciones físicas ni sensaciones corporales, por lo que la dominancia de la emoción de defensa se basa principalmente en el aspecto cognitivo.",DISCURSO_048_FR_002,contradestinatario,defensa
Cognoscitiva,"El discurso expresa indignación principalmente a través de juicios y evaluaciones morales: se condena a Maduro como ""dictador criminal"" y se critica la detención por un delito tan leve. No se mencionan manifestaciones físicas o sensaciones corporales, por lo que la dominancia se identifica como cognoscitiva.",DISCURSO_048_FR_003,prodestinatario,indignación
Cognoscitiva,"La ira expresada en el discurso se fundamenta principalmente en juicios y evaluaciones morales sobre la acusación de criminalidad y la represión del dictador Nicolás Maduro. El texto enfatiza la percepción de injusticia y la crítica a la autoridad, lo que indica que la emoción se origina en procesos cognitivos de valoración y condena, más que en manifestaciones físicas explícitas.",DISCURSO_048_FR_003,prodestinatario,ira
Cognoscitiva,"El orgullo expresado en el discurso se fundamenta en la valoración y reconocimiento de la acción de Milei como defensor de la libertad frente a un régimen opresivo. No se menciona ninguna manifestación física, gesto o sensación corporal asociada a la emoción; la referencia se centra en la evaluación positiva de la conducta de Milei y la interpretación de su valentía. Por lo tanto, la dominancia de la emoción identificada es cognoscitiva, basada en juicios y evaluaciones mentales.",DISCURSO_048_FR_003,prodestinatario,orgullo
Cognoscitiva,"La indignación se manifiesta principalmente a través de juicios y evaluaciones morales sobre la injusticia percibida (la represión por parte de Maduro). No se indican manifestaciones corporales o sensaciones físicas, por lo que la dominancia se clasifica como cognoscitiva.",DISCURSO_048_FR_003,paradestinatario,indignación
Cognoscitiva,"La emoción de ira se desencadena principalmente por la evaluación cognitiva de la injusticia percibida: la audiencia neutra interpreta la detención como un acto arbitrario y cruel, lo que genera juicios negativos y pensamientos críticos sobre la actuación de las fuerzas de seguridad. No se menciona manifestaciones físicas explícitas, por lo que la dominancia se clasifica como cognoscitiva.",DISCURSO_048_FR_003,paradestinatario,ira
Cognoscitiva,"La empatía en este contexto se manifiesta principalmente a través de juicios y evaluaciones sobre la injusticia del arresto, lo que indica una dominancia cognoscitiva. No se observan indicios de manifestaciones físicas o sensaciones corporales asociadas a la emoción, por lo que la dominancia se clasifica como cognoscitiva.",DISCURSO_048_FR_003,paradestinatario,empatía
Cognoscitiva,"La indignación del contradestinatario se basa en la evaluación crítica de la acción de detención como injusta y política, sin indicios de manifestaciones corporales explícitas; por lo tanto, la dominancia es cognoscitiva.",DISCURSO_048_FR_003,contradestinatario,indignación
Cognoscitiva,"La frustración descrita surge principalmente de la evaluación cognitiva de la situación: el hablante percibe que se le acusa indirectamente de apoyar a un régimen opresivo, lo que genera un juicio de injusticia y bloqueo de metas. No se menciona manifestaciones físicas explícitas, por lo que la dominancia se identifica como cognoscitiva.",DISCURSO_048_FR_003,contradestinatario,frustración
Cognoscitiva,"El discurso de indignación se manifiesta principalmente a través de juicios y evaluaciones racionales: la expresión ""exigimos su liberación inmediata"" y la promesa de ""agotar todas las vías diplomáticas"" reflejan una valoración crítica de la injusticia percibida y una planificación de acciones basadas en la lógica política. No se observan indicios de manifestaciones corporales explícitas (sensaciones físicas, gestos), por lo que la dominancia se clasifica como cognoscitiva.",DISCURSO_048_FR_004,Partido político de Javier Milei y su base electoral (prodestinatario),indignación
Cognoscitiva,"La frase muestra una intención firme y planificada, con verbos de acción y compromiso, reflejando juicios y evaluaciones de la situación, sin indicios de manifestaciones corporales.",DISCURSO_048_FR_004,Partido político de Javier Milei y su base electoral (prodestinatario),determinación
Cognoscitiva,"La emoción de esperanza se manifiesta principalmente a través de juicios y evaluaciones sobre la posibilidad de un resultado positivo. En la frase se expresa la expectativa de que la liberación sea exitosa y se planifican acciones concretas (agotar vías diplomáticas) para lograrlo, lo que indica una valoración cognitiva de la situación sin referencia a sensaciones corporales. Por lo tanto, la dominancia es cognoscitiva.",DISCURSO_048_FR_004,Público general argentino (paradestinatario),esperanza
cognoscitiva,"La emoción de frustración se manifiesta principalmente a través de juicios y evaluaciones cognitivas sobre la imposibilidad de lograr el objetivo de liberar al individuo. En el discurso no aparecen indicios de manifestaciones físicas o sensaciones corporales; la expresión se centra en la demanda y la evaluación de las vías diplomáticas como medios para alcanzar la meta, lo que indica una dominancia cognoscitiva.",DISCURSO_048_FR_004,Oposición política (la casta política) (contradestinatario),frustración
Cognoscitiva,"El sentimiento de orgullo se manifiesta principalmente a través de la valoración y reconocimiento verbal de los logros militares y la posición del partido, sin indicios de manifestaciones físicas o sensaciones corporales. La expresión se centra en juicios y evaluaciones sobre el desempeño y la importancia de los nuevos egresados, lo que indica una dominancia cognoscitiva de la emoción.",DISCURSO_048_FR_005,Partido político de Javier Milei y su base electoral,pride
Cognoscitiva,"El discurso expresa respeto a través de juicios y evaluaciones sociales: se saluda a altos cargos, se reconoce la presencia de los integrantes del poder ejecutivo y se destaca la importancia de los nuevos egresados. No se menciona ninguna manifestación física, gesto corporal ni sensación sensorial, por lo que la emoción se manifiesta principalmente en el ámbito cognitivo.",DISCURSO_048_FR_005,Partido político de Javier Milei y su base electoral,respect
Cognoscitiva,"El discurso expresa solidaridad principalmente a través de la valoración y reconocimiento verbal de los distintos rangos militares, enfatizando la unidad y el compromiso del partido con las fuerzas armadas. No se mencionan manifestaciones físicas ni sensaciones corporales, por lo que la emoción se manifiesta en juicios y evaluaciones cognitivas.",DISCURSO_048_FR_005,Partido político de Javier Milei y su base electoral,solidarity
Cognoscitiva,"El discurso muestra confianza mediante la valoración positiva de la autoridad y la seguridad nacional, sin manifestaciones físicas; por tanto la dominancia es cognoscitiva.",DISCURSO_048_FR_005,Partido político de Javier Milei y su base electoral,confidence
Mixta,"El discurso muestra indicios tanto corporales como cognoscitivos. La acción de saludar al ministro, a los jefes del Estado Mayor y a los egresados implica gestos físicos (saludo, posible gesto de respeto) que indican una manifestación corporal. Al mismo tiempo, el contenido del mensaje expresa una valoración y reconocimiento de la institución militar y sus integrantes, lo que constituye un juicio evaluativo y una actitud de respeto, característico de la dominancia cognoscitiva. La combinación de estos dos tipos de indicios sugiere una dominancia mixta para la emoción de respeto.",DISCURSO_048_FR_005,Público general argentino,respect
Cognoscitiva,"El discurso se centra en la valoración y reconocimiento de la profesionalidad y el compromiso de los nuevos oficiales, lo que implica juicios y evaluaciones mentales sobre su desempeño. No se mencionan manifestaciones físicas o sensaciones corporales, por lo que la emoción de admiración se expresa principalmente a nivel cognitivo.",DISCURSO_048_FR_005,Público general argentino,admiration
Cognoscitiva,"El sentimiento de escepticismo se manifiesta principalmente a través de juicios y evaluaciones críticas sobre la intención del presidente y la relación entre el Estado y las fuerzas armadas. No se describen manifestaciones físicas o gestos que indiquen una respuesta corporal dominante; por lo tanto, la dominancia se ubica en el ámbito cognoscitivo.",DISCURSO_048_FR_005,Oposición política (la casta política),skepticism
Cognoscitiva,"El resentimiento del experienciador se expresa principalmente mediante juicios y evaluaciones sobre la aparente preferencia del presidente hacia las fuerzas armadas, sin indicios de manifestaciones corporales o sensaciones físicas. Por lo tanto, la dominancia de la emoción es cognoscitiva.",DISCURSO_048_FR_005,Oposición política (la casta política),resentment
Cognoscitiva,"El sentimiento de gratitud se manifiesta principalmente a través de la valoración y reconocimiento verbal de la presencia de los asistentes, sin indicios de manifestaciones físicas o gestos que sugieran una dominancia corporal. Por lo tanto, la emoción se interpreta como predominantemente cognoscitiva.",DISCURSO_048_FR_006,Partido político de Javier Milei y su base electoral,gratitud
Cognoscitiva,"El discurso expresa gratitud mediante un reconocimiento verbal a la presencia de los asistentes, lo que implica juicios y evaluaciones de valor (apreciación, reconocimiento). No se menciona manifestaciones físicas ni sensaciones corporales, por lo que la dominancia se ubica en el ámbito cognoscitivo.",DISCURSO_048_FR_006,Público general argentino,gratitud
Cognoscitiva,"El discurso expresa el sentimiento de orgullo a través de la valoración cognitiva de la situación (“es un honor para mí”), sin mencionar manifestaciones físicas o sensaciones corporales. Por lo tanto, la dominancia de la emoción identificada se clasifica como cognoscitiva.",DISCURSO_048_FR_007,Partido político de Javier Milei y su base electoral (tipo: prodestinatario),pride
Cognoscitiva,"La emoción de admiración se manifiesta principalmente a través de juicios y evaluaciones cognitivas, como el reconocimiento del honor y el compromiso del presidente con las fuerzas armadas. No se observan indicios de manifestaciones físicas o sensaciones corporales, por lo que la dominancia se clasifica como cognoscitiva.",DISCURSO_048_FR_007,Partido político de Javier Milei y su base electoral (tipo: prodestinatario),admiration
Cognoscitiva,"El sentimiento de respeto se basa principalmente en la valoración y reconocimiento de la posición y el honor del presidente como figura de autoridad y comandante de las fuerzas armadas. No se menciona manifestaciones físicas o sensaciones corporales, sino una apreciación intelectual y evaluativa de su papel y la ceremonia, lo que indica una dominancia cognoscitiva.",DISCURSO_048_FR_007,Público general argentino (tipo: paradestinatario),respect
Cognoscitiva,"El discurso enfatiza el reconocimiento de un honor y la participación en una ceremonia, lo que sugiere una valoración y evaluación mental de la importancia del acto. No se mencionan sensaciones físicas ni gestos explícitos, por lo que la emoción de inspiración se manifiesta principalmente a través de juicios y pensamientos sobre el significado del evento.",DISCURSO_048_FR_007,Público general argentino (tipo: paradestinatario),inspiration
Cognoscitiva,"El sentimiento de amenaza se basa en la evaluación de la posición de poder del presidente y su participación en la ceremonia, lo que se percibe como una posible interferencia en la autonomía de la oposición; no hay indicios de manifestaciones corporales, por lo que la dominancia es cognoscitiva.",DISCURSO_048_FR_007,Oposición política (la casta política) (tipo: contradestinatario),threat
Cognoscitiva,"El resentimiento en la oposición se origina principalmente en la evaluación cognitiva de la situación: perciben que el presidente favorece a las fuerzas armadas, lo que genera una sensación de injusticia y favoritismo. No se observan indicios claros de manifestaciones corporales (sensaciones físicas o gestos) asociados a la emoción, por lo que la dominancia se clasifica como cognoscitiva.",DISCURSO_048_FR_007,Oposición política (la casta política) (tipo: contradestinatario),resentment
Cognoscitiva,"El orgullo expresado al dirigirse a los graduados se fundamenta principalmente en juicios y evaluaciones sobre el logro y la excelencia alcanzada por los recién titulados. No se observan indicios de manifestaciones físicas o sensaciones corporales asociadas a la emoción, lo que indica que la dominancia se sitúa en el ámbito cognitivo.",DISCURSO_048_FR_008,Partido político de Javier Milei y su base electoral (prodestinatario),orgullo
Cognoscitiva,"La emoción de anticipación se manifiesta principalmente a través de juicios y evaluaciones mentales sobre lo que se espera que el presidente diga a los graduados. No se describen manifestaciones físicas ni sensaciones corporales, por lo que la dominancia se ubica en el dominio cognoscitivo.",DISCURSO_048_FR_008,Público general argentino (paradestinatario),anticipación
Cognoscitiva,"La indignación del opositor se basa principalmente en juicios y evaluaciones sobre la percepción de una maniobra política injusta, sin evidencia de manifestaciones corporales explícitas en el contexto proporcionado.",DISCURSO_048_FR_008,Oposición política (la casta política) (contradestinatario),indignación
Cognoscitiva,"El discurso expresa orgullo a través de juicios y evaluaciones sobre el logro de los graduados, sin mencionar manifestaciones físicas o sensaciones corporales. La felicitación se centra en reconocer el esfuerzo y la elección de servicio a la patria, lo que indica una dominancia cognoscitiva de la emoción.",DISCURSO_048_FR_009,Partido político de Javier Milei y su base electoral (tipo: prodestinatario),orgullo
Cognoscitiva,"El orgullo expresado en el discurso se manifiesta principalmente a través de juicios y evaluaciones: el reconocimiento de la finalización de la formación básica y la felicitación por la elección de servir a la patria implican una valoración positiva de la acción y del logro. No se mencionan manifestaciones físicas o sensaciones corporales, por lo que la dominancia se ubica en el dominio cognoscitivo.",DISCURSO_048_FR_009,Público general argentino (tipo: paradestinatario),orgullo
Cognoscitiva,"El orgullo expresado se basa en la valoración de los logros académicos y la transición a la vida profesional, alineándose con los valores del partido y la base electoral. La frase enfatiza juicios y evaluaciones de éxito y pertenencia, sin indicios claros de manifestaciones corporales, por lo que la dominancia es cognoscitiva.",DISCURSO_048_FR_010,Partido político de Javier Milei y su base electoral,orgullo
Cognoscitiva,"La emoción de esperanza se manifiesta principalmente a través de juicios y evaluaciones sobre el futuro, como la expectativa de que la nueva generación cumplirá con los ideales del partido. En el discurso no se mencionan manifestaciones físicas o sensaciones corporales, sino una valoración positiva y una proyección hacia adelante, lo que indica una dominancia cognoscitiva.",DISCURSO_048_FR_010,Partido político de Javier Milei y su base electoral,esperanza
Cognoscitiva,"El orgullo expresado por el público general argentino se manifiesta principalmente a través de juicios y evaluaciones positivas sobre la culminación de la formación militar y el inicio de la carrera profesional de los estudiantes. No se observan indicios de manifestaciones corporales explícitas (sensaciones físicas, gestos), por lo que la dominancia se clasifica como cognoscitiva.",DISCURSO_048_FR_010,Público general argentino,orgullo
Cognoscitiva,"La emoción de inspiración se manifiesta principalmente a través de juicios y evaluaciones sobre la disciplina y el compromiso que se exige en la vida profesional. El discurso invita al público a reflexionar sobre la exigencia permanente y a motivarse cognitivamente, sin enfatizar manifestaciones físicas explícitas.",DISCURSO_048_FR_010,Público general argentino,inspiración
Cognoscitiva,"La ansiedad descrita se centra en la evaluación de la pérdida de influencia y la presión constante que se espera en la vida profesional, lo que indica que la emoción se manifiesta principalmente a través de juicios y pensamientos sobre la situación, sin indicios explícitos de manifestaciones corporales.",DISCURSO_048_FR_010,Oposición política (la casta política),ansiedad
Cognoscitiva,"El resentimiento se manifiesta principalmente en juicios y evaluaciones sobre la amenaza percibida a la posición política de la oposición, sin evidencia de manifestaciones corporales explícitas en el discurso. La percepción de injusticia y la valoración crítica de la amenaza generan una respuesta cognitiva dominante.",DISCURSO_048_FR_010,Oposición política (la casta política),resentimiento
